Pasal,Isi
Pasal 1392,"Jika barang yang terutang itu hanya ditentukan jenisnya, maka untuk membebaskan diri dan utangnya, debitur tidak wajib memberikan barang dan jenis yang terbaik, tetapi tak cukuplah ia memberikan barang dan jenis yang terburuk."
Pasal 1393,"Pembayaran harus dilakukan di tempat yang ditetapkan dalam persetujuan, jika dalam persetujuan tidak ditetapkan suatu tempat, maka pembayaran mengenai suatu barang yang sudah ditentukan, harus terjadi di tempat barang itu berada sewaktu perjanjian dibuat. Di luar kedua hal tersebut, pembayaran harus dilakukan di tempat tinggal kreditur, selama orang ini terus menerus berdiam dalam keresidenan tempat tinggalnya sewaktu persetujuan dibuat, dan dalam hal-hal lain di tempat tinggal debitur."
Pasal 1394,"Mengenai pembayaran sewa rumah, sewa tanah, tunjangan tahunan untuk nafkah, bunga abadi atau bunga cagak hidup, bunga uang pinjaman, dan pada umumnya segala sesuatu yang harus dibayar tiap tahun atau tiap waktu yang lebih pendek, maka dengan adanya tiga surat tanda pembayaran tiga angsuran berturut-turut, timbul suatu persangkaan bahwa angsuran-angsuran yang lebih dahulu telah dibayar lunas, kecuali jika dibuktikan sebaliknya."
Pasal 1395,"Biaya yang harus dikeluarkan untuk menyelenggarakan pembayaran, ditanggung oleh debitur."
Pasal 1396,"Seorang yang mempunyai berbagai utang, pada waktu melakukan pembayaran berhak menyatakan utang mana yang hendak dibayarnya."
Pasal 1397,"Seorang yang mempunyai utang dengan bunga, tanpa izin kreditur, tak dapat melakukan pembayaran untuk pelunasan uang pokok lebih dahulu dengan menunda pembayaran bunganya. Pembayaran yang dilakukan untuk uang pokok dan bunga, tetapi tidak cukup untuk melunasi seluruh utang, digunakan terlebih dahulu untuk melunasi bunga."
Pasal 1398,"Jika seseorang, yang mempunyai berbagai utang uang, menerima suatu tanda pembayaran sedangkan kreditur telah menyatakan bahwa apa yang diterimanya itu adalah khusus untuk melunasi salah satu di antara utang-utang tersebut, maka tak dapat lagi debitur menuntut supaya pembayaran itu dianggap sebagai pelunasan suatu utang yang lain, kecuali jika oleh pihak kreditur telah dilakukan penipuan, atau debitur dengan sengaja tidak diberi tahu tentang adanya pernyataan tersebut."
Pasal 1399,"Jika tanda pembayaran tidak menyebutkan untuk utang mana pembayaran dilakukan, maka pembayaran itu harus dianggap sebagai pelunas utang yang pada waktu itu paling perlu dilunasi debitur di antara utang-utang yang sama-sama dapat ditagih, maka pembayaran harus dianggap sebagai pelunasan utang yang dapat ditagih lebih dahulu daripada utang-utang lainnya, meskipun utang yang terdahulu tadi kurang penting sifatnya daripada utang-utang lainnya itu."
Pasal 1400,"Subrogasi atau perpindahan hak kreditur kepada seorang pihak ketiga yang membayar kepada kreditur, dapat terjadi karena persetujuan atau karena undang-undang."
Pasal 1401,Perpindahan itu terjadi karena persetujuan:
Pasal 1402," Subrogasi terjadi karena undang-undang: 1. untuk seorang kreditur yang melunasi utang seorang debitur kepada seorang kreditur lain, yang berdasarkan hak istimewa atau hipoteknya mempunyai suatu hak yang lebih tinggi dan pada kreditur tersebut pertama; 2. untuk seorang pembeli suatu barang tak bergerak, yang memakai uang harga barang tersebut untuk melunasi para kreditur, kepada siapa barang itu diperikatkan dalam hipotek; 3. untuk seorang yang terikat untuk melunasi suatu utang bersama-sama dengan orang lain, atau untuk orang lain dan berkepentingan untuk membayar utang itu; 4. untuk seorang ahli waris yang telah membayar utang-utang warisan dengan uangnya sendiri, sedang ia menerima warisan itu dengan hak istimewa untuk mengadakan pencatatan tentang keadaan harta peninggalan itu."
Pasal 1403,"Subrogasi yang ditetapkan dalam pasal-pasal yang lalu terjadi, baik terhadap orang-orang penanggung utang maupun terhadap para debitur, subrogasi tersebut tidak dapat mengurangi hak-hak kreditur jika ia hanya menerima pembayaran sebagian; dalam hal ini ia dapat melaksanakan hak-haknya mengenai apa yang masih harus dibayar kepadanya, lebih dahulu daripada orang yang memberinya suatu pembayaran sebagian."
Pasal 1404,"Jika kreditur menolak pembayaran, maka debitur dapat melakukan penawaran pembayaran tunai atas apa yang harus dibayarnya, dan jika kreditur juga menolaknya,, maka debitur dapat menitipkan uang atau barangnya kepada Pengadilan. Penawaran demikian, yang diikuti dengan penitipan, membebaskan debitur dan berlaku baginya sebagai pembayaran, asal penawaran itu dilakukan menurut undang-undang, sedangkan apa yang dititipkan secara demikian adalah atas tanggungan kreditur."
Pasal 1405,"Agar penawaran yang demikian sah, perlu:"
Pasal 1406,"Agar suatu penyimpanan sah, tidak perlu adanya kuasa dan Hakim cukuplah:"
Pasal 1407,"Biaya yang dikeluarkan untuk menyelenggarakan penawaran pembayaran tunai dan penyimpanan harus dipikul oleh kreditur, jika hal itu dilakukan sesuai dengan undang-undang."
Pasal 1408,"Selama apa yang dititipkan itu tidak diambil oleh kreditur, debitur dapat mengambilnya kembali, dalam hal itu orang-orang yang turut berutang dan para penanggung utang tidak dibebaskan."
Pasal 1409,"Bila debitur sendiri sudah memperoleh suatu putusan Hakim yang telah memperoleh kekuatan hukum yang pasti, dan dengan putusan itu penawaran yang dilakukannya telah dinyatakan sah, maka ia tidak dapat lagi mengambil kembali apa yang dititipkan untuk kerugian orang-orang yang ikut berutang dan para penanggung utang, meskipun dengan izin kreditur."
Pasal 1410,"Orang-orang yang ikut berutang dan para penanggung utang dibebaskan juga, jika kreditur, semenjak hari pemberitahuan penyimpanan, telah melewatkan waktu satu tahun, tanpa menyangkal sahnya penyimpanan itu."
Pasal 1411,"Kreditur yang telah mengizinkan barang yang dititipkan itu diambil kembali oleh debitur setelah penitipan itu, dikuatkan putusan Hakim yang telah memperoleh kekuatan hukum yang pasti, tidak dapat lagi menggunakan hak-hak istimewanya atau hipotek yang melekat pada piutang tersebut untuk menuntut pembayaran piutangnya."
Pasal 1412,"Jika apa yang harus dibayar berupa suatu barang yang harus diserahkan di tempat barang itu berada, maka debitur harus memperingatkan kreditur dengan perantaraan pengadilan supaya mengambilnya, dengan suatu akta yang harus diberitahukan kepada kreditur sendiri atau ke alamat tempat tinggalnya, atau ke alamat tempat tinggal yang dipilih untuk pelaksanaan persetujuan. Jika peringatan itu telah dijalankan dan kreditur tidak mengambil barangnya, maka debitur dapat diizinkan oleh Hakim untuk menitipkan barang tersebut di suatu tempat lain."
Pasal 1414,Pembaruan utang hanya dapat dilakukan antara orang-orang yang cakap untuk mengadakan perikatan.
Pasal 1415,Pembaruan utang tidak dapat hanya dikira-kira; kehendak seorang untuk mengadakannya harus terbukti dan isi akta.
Pasal 1416,"Pembaruan utang dengan penunjukan seorang debitur baru untuk mengganti yang lama, dapat dijalankan tanpa bantuan debitur pertama."
Pasal 1417,"Pemberian kuasa atau pemindahan, dengan mana seorang debitur memberikan kepada seorang kreditur seorang debitur baru yang mengikatkan dirinya kepada kreditur, tidak menimbulkan suatu pembaruan utang, jika kreditur tidak secara tegas mengatakan bahwa ia bermaksud membebaskan debitur yang melakukan pemindahan itu dan perikatannya."
Pasal 1418,"Kreditur yang membebaskan debitur yang melakukan pemindahan, tak dapat menuntut orang tersebut, jika orang yang ditunjuk untuk menggantikan itu jatuh pailit atau nyata-nyata tak mampu, kecuali jika hak untuk menuntut itu dengan tegas dipertahankan dalam persetujuan, atau jika debitur yang telah ditunjuk sebagai pengganti itu pada saat pemindahan telah nyata- nyata bangkrut, atau kekayaannya telah berada dalam keadaan terus-menerus merosot."
Pasal 1419,"Debitur yang dengan pemindahan telah mengikatkan dininya kepada seorang kreditur baru dan dengan demikian telah dibebaskan dan kreditur lama, tak dapat mengajukan terhadap kreditur baru itu tangkisan-tangkisan yang sebenarnya dapat ia ajukan terhadap kreditur lama, meskipun ini tidak dikatakannya sewaktu membuat perikatan baru; namun dalam hal yang terakhir ini tidaklah berkurang haknya untuk menuntut kreditur lama."
Pasal 1420,"Jika debitur hanya menunjuk seseorang yang harus membayar untuk dia, maka tidak terjadi suatu pembaruan utang. Hal yang sama berlaku jika kreditur hanya menunjuk seseorang yang diwajibkan menerima pembayaran utang untuknya."
Pasal 1421,"Hak-hak istimewa dan hipotek yang melekat pada piutang lama, tidak berpindah pada piutang baru yang menggantikannya, kecuali jika hal itu secara tegas dipertahankan oleh debitur."
Pasal 1422,"Bila pembaruan utang diadakan dengan penunjukan seorang debitur baru yang menggantikan debitur lama, maka hak-hak istimewa dan hipotek-hipotek yang dan semula melekat pada piutang, tidak berpindah ke barang debitur baru."
Pasal 1423,"Bila pembaruan utang diadakan antara kreditur dan salah seorang dan para debitur yang berutang secara tanggung-menanggung, maka hak-hak istimewa dan hipotek tidak dapat dipertahankan selain atas barang-barang orang yang membuat perikatan baru itu."
Pasal 1424,"Karena adanya pembaruan utang antara kreditur dan salah seorang para debitur yang berutang secara tanggung-menanggung, maka para debitur lainnya dibebaskan dan perikatan. Pembaruan utang yang dilakukan terhadap debitur utama membebaskan para penanggung utang. Meskipun demikian, jika dalam hal yang pertama kreditur telah menuntut para debitur lain itu, atau dalam hal yang kedua ia telah menuntut para penanggung utang supaya turut serta dalam perjanjian baru, tetapi orang-orang itu menolak, maka perikatan utang lama tetap berlaku."
Pasal 1425,"Jika dua orang saling berutang, maka terjadilah antara mereka suatu perjumpaan utang yang menghapuskan utang-utang kedua orang tersebut dengan cara dan dalam hal-hal berikut."
Pasal 1426,"Perjumpaan terjadi demi hukum, bahkan tanpa setahu debitur, dan kedua utang itu saling menghapuskan pada saat utang itu bersama-sama ada, bertimbal balik untuk jumlah yang sama."
Pasal 1427,"Perjumpaan hanya terjadi antara dua utang yang dua-duanya berpokok sejumlah utang, atau sejumlah barang-barang yang dapat dihabiskan dan jenis yang sama, dan yang dua-duanya dapat diselesaikan dan ditagih seketika. Bahan makanan, gandum dan hasil-hasil pertanian yang penyerahannya tidak dibantah dan harganya dapat ditetapkan menurut catatan harga atau keterangan lain yang biasa dipakai di Indonesia, dapat diperjumpakan dengan sejumlah uang yang telah diselesaikan dan seketika dapat ditagih."
Pasal 1428,Semua penundaan pembayaran kepada seseorang tidak menghalangi suatu perjumpaan utang.
Pasal 1429,"Perjumpaan terjadi tanpa membedakan sumber piutang kedua belah pihak itu, kecuali:"
Pasal 1430,"Seorang penanggung utang boleh memperjuangkan apa yang wajib dibayar kepada debitur utama, tetapi debitur utama tak diperkenankan memperjumpakan apa yang harus dibayar kreditur kepada penanggung utang. Debitur dalam perikatan tanggung menanggung, juga tidak boleh memperjumpakan apa yang harus dibayar kreditur kepada debitur lain."
Pasal 1431,"Seorang debitur yang secara murni dan sederhana telah menyetujui pemindahan hak-hak yang dilakukan oleh kreditur kepada seorang pihak ketiga, tak boleh lagi menggunakan terhadap pihak ketiga ini suatu perjumpaan utang yang sedianya dapat diajukan kepada kreditur sebelum pemindahan hak-hak tersebut. Pemindahan hak-hak yang tidak disetujui oleh debitur, tetapi telah diberitahukan kepadanya, hanyalah menghalangi perjumpaan utang-utang yang lahir sesudah pemberitahuan tersebut."
Pasal 1432,"Jika utang-utang kedua belah pihak tidak dapat dibayar di tempat yang sama, maka utang-utang itu tidak dapat diperjumpakan tanpa mengganti biaya pengiriman."
Pasal 1433,"Jika terdapat sebagian utang yang harus diperjumpakan dan dapat ditagih dan satu orang, maka dalam melakukan perjumpaan, harus diturut peraturan-peraturan yang ditulis dalam pasal 1399."
Pasal 1434,"Perjumpaan tidak dapat terjadi atas kerugian hak yang diperoleh seorang pihak ketiga. Dengan demikian, seorang debitur yang kemudian menjadi kreditur pula, setelah pihak ketiga menyita barang yang harus dibayarkan, tak dapat menggunakan perjumpaan utang atas kerugian si penyita."
Pasal 1435,"Seseorang yang telah membayar suatu utang yang telah dihapuskan demi hukum karena perjumpaan, pada waktu menagih suatu piutang yang tidak diperjumpakan, tak dapat lagi menggunakan hak istimewa dan hipotek-hipotek yang melekat pada piutang itu untuk kerugian pihak ketiga, kecuali jika ada suatu alasan sah yang menyebabkan ia tidak tahu tentang adanya piutang tersebut yang seharusnya diperjumpakan dengan utangnya."
Pasal 1436,"Bila kedudukan sebagai kreditur dan debitur berkumpul pada satu orang, maka terjadilah demi hukum suatu percampuran utang dan oleh sebab itu piutang dihapuskan."
Pasal 1437,Percampuran Utang yang terjadi pada debitur utama berlaku juga untuk keuntungan para penanggung utangnya.
Pasal 1438,"Pembebasan suatu utang tidak dapat hanya diduga-duga, melainkan harus dibuktikan."
Pasal 1439,"Pengembalian sepucuk surat piutang di bawah tangan yang asli secara sukarela oleh kreditur kepada debitur, bahkan juga terhadap orang-orang lain yang turut berutang secara tanggung- menanggung."
Pasal 1440,"Pembebasan suatu utang atau pelepasan menurut persetujuan untuk kepentingan salah seorang debitur dalam perikatan tanggung-menanggung, membebaskan semua debitur yang lain, kecuali jika kreditur dengan tegas menyatakan hendak mempertahankan hak-haknya terhadap orang-orang tersebut terakhir; dalam hal itu, ia tidak dapat menagih piutangnya sebelum dikurangkan bagian dan debitur yang telah dibebaskan olehnya."
Pasal 1441,Pengambilan barang yang diberikan dalam gadai tidaklah cukup untuk menjadikan alasan dugaan tentang pembebasan utang.
Pasal 1442,"Pembebasan suatu utang atau pelepasan menurut persetujuan yang diberikan kepada debitur utama, membebaskan para penanggung utang. Pembebasan yang diberikan kepada salah seorang penanggung utang, tidak membebaskan para penanggung lainnya."
Pasal 1443,"Apa yang telah diterima kreditur dan seorang penanggung Utang sebagai pelunasan tanggungannya, harus dianggap telah dibayar untuk mengurangi utang yang bersangkutan, dan harus digunakan untuk melunasi utang debitur utama dan tanggungan para penanggung lainnya."
Pasal 1444,"Jika barang tertentu yang menjadi pokok persetujuan musnah, tak dapat diperdagangkan, atau hilang hingga tak diketahui sama sekali apakah barang itu masih ada, atau tidak, maka hapuslah perikatannya, asal barang itu musnah atau hilang di luar kesalahan debitur dan sebelum ia lalai menyerahkannya.Bahkan meskipun debitur lalai menyerahkan suatu barang, yang sebelumnya tidak ditanggung terhadap kejadian-kejadian yang tak terduga, perikatan tetap hapus jika barang itu akan musnah juga dengan cara yang sama di tangan kreditur, seandainya barang tersebut sudah diserahkan kepadanya. Debitur diwajibkan membuktikan kejadian tak terduga yang dikemukakannya.Dengan cara bagaimanapun suatu barang hilang atau musnah, orang yang mengambil barang itu sekali-kali tidak bebas dan kewajiban untuk mengganti harga."
Pasal 1445,"Jika barang yang terutang musnah, tak lagi dapat diperdagangkan, atau hilang di luar kesalahan debitur, maka debitur, jika ia mempunyai hak atau tuntutan ganti rugi mengenai barang tersebut, diwajibkan memberikan hak dan tuntutan tersebut kepada kreditur."
Pasal 1446,"Semua perikatan yang dibuat oleh anak yang belum dewasa, atau orang-orang yang berada di bawah pengampuan adalah batal demi hukum, dan atas tuntutan yang diajukan oleh atau dan pihak mereka, harus dinyatakan batal, semata-mata atas dasar kebelumdewasaan atau pengampuannya.Perikatan yang dibuat oleh perempuan yang bersuami dan oleh anak-anak yang belum dewasa yang telah disamakan dengan orang dewasa, tidak batal demi hukum, sejauh perikatan tersebut tidak melampaui batas kekuasaan mereka."
Pasal 1447,Ketentuan pasal yang lalu tidak berlaku untuk perikatan yang timbul dan suatu kejahatan atau pelanggaran atau dan suatu perbuatan yang telah menimbulkan kerugian bagi orang lain.
Pasal 1448,"Jika tata cara yang ditentukan untuk sahnya perbuatan yang menguntungkan anak-anak yang belum dewasa dan orang-orang yang berada di bawah pengampuan telah terpenuhi, atau jika orang yang menjalankan kekuasaan orangtua, wali atau pengampu telah melakukan perbuatan- perbuatan yang tidak melampaui batas-batas kekuasaannya, maka anak-anak yang belum dewasa dan orang-orang yang berada di bawah pengampuan itu dianggap telah melakukan sendiri perbuatan-perbuatan itu setelah mereka menjadi dewasa atau tidak lagi berada di bawah pengampuan, tanpa mengurangi hak mereka untuk menuntut orang yang melakukan kekuasaan orangtua, wali atau pengampu itu bila ada alasan untuk itu."
Pasal 1449,"Perikatan yang dibuat dengan paksaan, penyesatan atau penipuan, menimbulkan tuntutan untuk membatalkannya."
Pasal 1450,"Dengan alasan telah dirugikan, orang-orang dewasa, dan juga anak-anak yang belum dewasa bila mereka dapat dianggap sebagai orang dewasa, hanyalah dapat menuntut pembatalan pengikatan yang telah mereka buat dalam hal-hal khusus yang ditetapkan undang-undang."
Pasal 1451,"Pernyataan batalnya perikatan-perikatan berdasarkan ketidakcakapan orang-orang tersebut dalam Pasal 1330, mengakibatkan pulihnya barang-barang dan orang-orang yang bersangkutan dalam keadaan seperti sebelum perikatan dibuat, dengan pengertian bahwa segala sesuatu yang telah diberikan atau dibayar kepada orang tak berwenang, akibat perikatan itu, hanya dapat dituntut kembali bila barang yang bersangkutan masih berada di tangan orang tak berwenang"
Pasal 1452,"Pernyataan batal yang berdasarkan adanya paksaan, penyesatan atau penipuan, juga mengakibatkan barang dan orang yang bersangkutan pulih dalam keadaan seperti sebelum perikatan dibuat."
Pasal 1453,"Dalam hal-hal tersebut dalam Pasal 1446 dan 1449, orang yang terhadapnya tuntutan untuk pernyataan batalnya suatu perikatan dikabulkan, wajib juga mengganti biaya, kerugian dan bunga, jika ada alasan untuk itu."
Pasal 1454,"Bila suatu tuntutan untuk pernyataan batalnya suatu perikatan tidak dibatasi dengan suatu ketentuan undang-undang khusus mengenai waktu yang lebih pendek, maka suatu itu adalah lima tahun."
Pasal 1455,"Barangsiapa mengira bahwa ia dapat menuntut pembatalan suatu pengikatan atas dasar berbagai alasan, wajib mengajukan alasan-alasan itu sekaligus, atau ancaman akan ditolak alasan-alasan yang diajukan kemudian, kecuali bila alasan-alasan yang diajukan kemudian ternyata karena kesalahan pihak lawan, tidak dapat diketahui lebih dahulu."
Pasal 1456,"Tuntutan untuk pernyataan batalnya suatu perikatan, gugur jika perikatan itu dikuatkan secara tegas atau secara diam-diam, sebagai berikut: oleh anak yang belum dewasa, setelah ia menjadi dewasa; oleh orang yang berada di bawah pengampuan, setelah pengampuannya dihapuskan, oleh perempuan bersuami yang bertindak tanpa bantuan suaminya, setelah perkawinannya bubar; oleh orang yang mengajukan alasan adanya paksaan, penyesatan atau penipuan, setelah paksaan itu berhenti atau setelah penyesatan atau penipuan itu diketahuinya."
Pasal 1457,"Jual beli adalah suatu persetujuan dengan mana pihak yang satu mengikatkan dirinya untuk menyerahkan suatu barang, dan pihak yang lain untuk membayar harga yang dijanjikan."
Pasal 1458,"Jual beli dianggap telah terjadi antara kedua belah pihak, segera setelah orang-orang itu mencapai kesepakatan tentang barang tersebut beserta harganya, meskipun barang itu belum diserahkan dan harganya belum dibayar."
Pasal 1459,"Hak milik atas barang yang dijual tidak pindah kepada pembeli selama barang itu belum diserahkan menurut Pasal 612, 613 dan 616."
Pasal 1460,"Jika barang yang dijual itu berupa barang yang sudah ditentukan, maka sejak saat pembelian, barang itu menjadi tanggungan pembeli, meskipun penyerahannya belum dilakukan dan penjual berhak menuntut harganya."
Pasal 1461,"Jika barang dijual bukan menurut tumpukan melainkan menurut berat, jumlah dan ukuran, maka barang itu tetap menjadi tanggungan penjual sampai ditimbang, dihitung atau diukur."
Pasal 1462,"Sebaliknya jika barang itu dijual menurut tumpukan, maka barang itu menjadi tanggungan pembeli, meskipun belum ditimbang, dihitung atau diukur."
Pasal 1463,"Jual beli yang dilakukan dengan percobaan atau atas barang yang biasanya dicoba terlebih dahulu, selalu dianggap telah dilakukan dengan syarat tangguh."
Pasal 1464,"Jika pembelian dilakukan dengan memberi uang panjar, maka salah satu pihak tak dapat membatalkan pembelian itu dengan menyuruh memiliki atau mengembalikan uang panjarnya."
Pasal 1465,Harga beli harus ditetapkan oleh kedua belah pihak. Namun penaksirannya dapat diserahkan kepada pihak ketiga.
Pasal 1466,Biaya akta jual beli dan biaya tambahan lain dipikul oleh pembeli kecuali kalau diperjanjikan sebaliknya.
Pasal 1467,"Antara suami istri tidak dapat terjadi jual beli, kecuali dalam tiga hal berikut:"
Pasal 1468,"Para Hakim, Jaksa, Panitera, Advokat, Pengacara, Juru Sita dan Notaris tidak boleh atas dasar penyerahan menjadi pemilik hak dan tuntutan yang menjadi pokok perkara yang sedang ditangani oleh Pengadilan Negeri yang dalam wilayahnya mereka melakukan pekerjaan, atas ancaman kebatalan serta penggantian biaya, kerugian dan bunga."
Pasal 1469,"Atas ancaman yang sama, para pegawai yang memangku suatu jabatan umum tidak boleh membeli barang-barang yang dijual oleh atau di hadapan mereka, untuk dirinya sendiri atau untuk orang lain."
Pasal 1470,"Begitu pula atas ancaman yang sama, tidaklah boleh menjadi pembeli pada penjualan di bawah tangan, baik pembelian itu dilakukan oleh mereka sendiri maupun melalui perantara:"
Pasal 1471,"Jual beli atas barang orang lain adalah batal dan dapat memberikan dasar kepada pembeli untuk menuntut penggantian biaya, kerugian dan bunga, jika ia tidak mengetahui bahwa barang itu kepunyaan orang lain."
Pasal 1472,"Jika ada saat penjualan, barang yang dijual telah musnah sama sekali, maka pembelian adalah batal."
Pasal 1473,"Penjual wajib menyatakan dengan jelas, untuk apa ia mengikatkan dirinya, janji yang tidak jelas dan dapat diartikan dalam berbagai pengertian, harus ditafsirkan untuk kerugiannya."
Pasal 1474 ,"Penjual mempunyai dua kewajiban utama, yaitu menyerahkan barangnya dan menanggungnya."
Pasal 1475,Penyerahan ialah pemindahan barang yang telah dijual ke dalam kekuasaan dan hak milik si pembeli.
Pasal 1476,"Biaya penyerahan dipikul oleh penjual, sedangkan biaya pengambilan dipikul oleh pembeli, kecuali kalau diperjanjikan sebaliknya."
Pasal 1477,"Penyerahan harus dilakukan di tempat barang yang dijual itu berada pada waktu penjualan, jika tentang hal itu tidak diadakan persetujuan lain."
Pasal 1478,"Penjual tidak wajib menyerahkan barang yang bersangkutan, jika pembeli belum membayar harganya sedangkan penjual tidak mengizinkan penundaan pembayaran kepadanya."
Pasal 1479,Dihapus dengan S. 1906-348.
Pasal 1480,"Jika penyerahan tidak dapat dilaksanakan karena kelalaian penjual, maka pembeli dapat menuntut pembatalan pembelian menurut ketentuan-ketentuan Pasal 1266 dan 1267."
Pasal 1481,Barang yang bersangkutan harus diserahkan dalam keadaan seperti pada waktu penjualan.
Pasal 1482,"Kewajiban menyerahkan suatu barang meliputi segala sesuatu yang menjadi perlengkapannya dan dimaksudkan bagi pemakaiannya yang tetap, beserta surat bukti milik jika ada."
Pasal 1483,"Penjual wajib menyerahkan barang yang dijual dalam keadaan utuh, sebagaimana dinyatakan dalam persetujuan, dengan perubahan-perubahan sebagai berikut."
Pasal 1484,"Jika penjualan sebuah barang tak bergerak dilakukan dengan menyebutkan luas atau isinya dan hartanya ditentukan menurut ukurannya, maka penjual wajib menyerahkan jumlah yang dinyatakan dalam persetujuan; dan jika ia tidak mampu melakukannya atau pembeli tidak menuntutnya maka penjual harus bersedia menerima pengurangan harga menurut perimbangan."
Pasal 1485,"Sebaliknya, jika dalam hal yang disebutkan dalam pasal yang lalu barang tak bergerak itu ternyata lebih luas daripada yang dinyatakan dalam persetujuan, maka pembeli boleh memilih untuk menambah harganya menurut perbandingan atau untuk membatalkan pembelian itu, bila kelebihannya itu mencapai seperdua puluh dari luas yang dinyatakan dalam persetujuan."
Pasal 1486,"Dalam hal lain, baik jika yang dijual itu adalah barang tertentu maupun jika penjualan itu adalah mengenai pekarangan yang terbatas dan terpisah satu sama lain, ataupun jika penjualan itu mengenai suatu barang yang dari semula telah disebutkan ukurannya atau yang keterangan tentang ukurannya akan menyusul, maka penyebutan ukuran itu tidak dapat menjadi alasan bagi penjual untuk menambah harga untuk apa yang melebihi ukuran itu, pula tidak dapat menjadi alasan bagi pembeli untuk mengurangi harga untuk apa yang kurang dari ukuran itu kecuali bila selisih antara ukuran yang sebenarnya dan ukuran yang dinyatakan dalam persetujuan ada seperdua puluh, dihitung menurut harga seluruh barang yang dijual kecuali kalau dijanjikan sebaliknya."
Pasal 1487,"Jika menurut pasal yang lalu ada alasan untuk menaikkan harga untuk kelebihan dari ukuran, maka pembeli boleh memilih untuk membatalkan pembelian, atau untuk membayar harga yang telah dinaikkan serta bunga bila ia telah memegang barang yang tak bergerak itu."
Pasal 1488,"Dalam hal pembeli membatalkan pembelian penjual wajib mengembalikan harga barang, jika itu telah diterima olehnya dan juga biaya yang telah dikeluarkan untuk melakukan pembelian dan penyerahan sejauh pembeli telah membayarnya menurut persetujuan."
