,Pasal,Isi
0,Pasal 1,Menikmati hak-hak kewargaan tidak tergantung pada hak-hak kenegaraan.
1,Pasal 2,"Anak yang ada dalam kandungan seorang perempuan dianggap telah lahir, setiap kali kepentingan si anak menghendakinya. Bila telah mati sewaktu dilahirkan, dia dianggap tidak pernah ada."
2,Pasal 3,"Tiada suatu hukuman pun yang mengakibatkan kematian perdata, atau hilangnya segala hak- hak kewargaan."
3,Pasal 4,"Tanpa mengurangi ketentuan dalam Pasal 10 Ketentuan-ketentuan Umum Perundang- undangan di Indonesia, maka bagi golongan Eropa di seluruh Indonesia ada daftar kelahiran, daftar lapor kawin, daftar izin kawin, daftar perkawinan dan perceraian, dan daftar kematian. Pegawai yang ditugaskan menyelenggarakan daftar-daftar tersebut, dinamakan Pegawai Catatan Sipil."
4,Pasal 5,"Presiden, setelah mendengar Mahkamah Agung menentukan dengan peraturan tersendiri, tempat dan cara menyelenggarakan daftar-daftar tersebut, demikian pula cara menyusun akta- akta dan syarat-syarat yang harus diperhatikan. Dalam peraturan itu harus dicantumkan juga"
5,Pasal 6,"Tak seorang pun diperbolehkan mengganti nama keturunannya, atau menambahkan nama lain pada namanya tanpa izin Presiden. Barang siapa nama tidak dikenal keturunan atau nama depannya, diperbolehkan mengambil suatu nama keturunan atau nama depan, asalkan dengan izin Presiden."
6,Pasal 7,"Permohonan izin untuk itu tidak dapat dikabulkan sebelum habis jangka waktu empat bulan, terhitung mulai hari pemberitaan permohonan itu dalam Berita Negara."
7,Pasal 8,"Selama jangka waktu tersebut dalam pasal yang lalu, pihak-pihak yang berkepentingan diperbolehkan mengemukakan kepada Presiden, dengan surat permohonan, dasar-dasar yang mereka anggap menjadi keberatan untuk menentang permohonan tersebut."
8,Pasal 9,"Bila dalam hal yang dimaksud dalam alinea pertama Pasal 6 permohonan itu dikabulkan, maka surat penetapannya harus disampaikan kepada pegawai catatan sipil di tempat tinggal si pemohon, pegawai mana harus menuliskannya dalam buku daftar yang sedang berjalan, dan membuat catatan tentang hal itu pada margin akta kelahiran si pemohon."
9,Pasal 10,"Diperolehnya suatu nama sesuai dengan ketentuan-ketentuan dalam keempat pasal yang lalu, sekali-kali tidak boleh diajukan sebagal bukti adanya hubungan sanak saudara."
10,Pasal 11,
11,Pasal 12,"Bila Pengadilan Negeri mengizinkan penggantian atau penambahan nama depan, maka surat penetapannya harus disampaikan kepada Pegawai Catatan Sipil tempat tinggal si pemohon, dan pegawai itu harus membukukannya dalam daftar yang sedang berjalan, dan mencatatnya pula pada margin akta kelahiran."
12,Pasal 13,"Bila daftar tidak pernah ada, atau telah hilang dipalsui, diubah, robek, dimusnahkan, digelapkan atau dirusak, bila ada akta yang tidak terdapat dalam daftar itu atau bila dalam akta yang dibukukan terdapat kesesatan, kekeliruan atau kesalahan lain maka hal-hal itu dapat menjadi dasar untuk mengadakan penambahan atau perbaikan dalam daftar itu."
13,Pasal 14,"Permohonan untuk itu hanya dapat diajukan kepada Pengadilan Negeri, yang di daerah hukumnya daftar-daftar itu diselenggarakan atau seharusnya diselenggarakan dan untuk itu Pengadilan Negeri akan mengambil keputusan setelah mendengar kejaksaan dan pihak-pihak yang berkepentingan bila ada cukup alasan dan dengan tidak mengurangi kesempatan banding."
14,Pasal 15,Keputusan ini hanya berlaku antara pihak-pihak yang telah memohon atau yang pernah dipanggil.
15,Pasal 16,"Semua keputusan tentang pembetulan atau penambahan pada akta, yang telah memperoleh kekuatan tetap, harus dibuktikan oleh Pegawai Catatan Sipil dalam daftar-daftar yang sedang berjalan segera setelah diterbitkan dan bila ada perbaikan hal itu harus diberitakan pada margin akta yang diperbaiki, sesuai dengan ketentuan-ketentuan Reglemen tentang Catatan Sipil."
16,Pasal 18,Perubahan tempat tinggal terjadi dengan pindah rumah secara nyata ke tempat lain disertai niat untuk menempatkan pusat kediamannya di sana.
17,Pasal 19,"Niat itu dibuktikan dengan menyampaikan pernyataan kepada Kepala Pemerintahan, baik di tempat yang ditinggalkan, maupun di tempat tujuan pindah rumah kediaman. Bila tidak ada pernyataan, maka bukti tentang adanya niat itu harus disimpulkan dari keadaan-keadaannya."
18,Pasal 20,"Mereka yang ditugaskan untuk menjalankan dinas umum, dianggap bertempat tinggal di tempat mereka melaksanakan dinas."
19,Pasal 21,"Seorang perempuan yang telah kawin dan tidak pisah meja dan ranjang, tidak mempunyai tempat tinggal lain daripada tempat tinggal suaminya; anak-anak di bawah umur mengikuti tempat tinggal salah satu dan kedua orang tua mereka yang melakukan kekuasaan orang tua atas mereka, atau tempat tinggal wali mereka; orang-orang dewasa yang berada di bawah pengampuan mengikuti tempat tinggal pengampuan mereka."
20,Pasal 22,"Dengan tidak mengurangi ketentuan dalam pasal yang lalu, buruh mempunyai tempat tinggal di rumah majikan mereka bila mereka tinggal serumah dengannya."
21,Pasal 23,Yang dianggap sebagai rumah kematian seseorang yang meninggal dunia adalah rumah tempat tinggalnya yang terakhir.
22,Pasal 24,"Dalam suatu akta dan terhadap suatu soal tertentu, kedua pihak atau salah satu pihak bebas untuk memilih tempat tinggal yang lain daripada tempat tinggal yang sebenarnya. Pemilihan itu dapat dilakukan secara mutlak, bahkan sampai meliputi pelaksanaan putusan Hakim, atau dapat dibatasi sedemikian rupa sebagaimana dikehendaki oleh kedua pihak atau salah satu pihak. Dalam hal ini surat-surat juru sita, gugatan-gugatan atau tuntutan-tuntutan yang tercantum atau termaksud dalam akta itu boleh dilakukan di tempat tinggal yang dipilih dan di muka Hakim tempat tinggal itu."
23,Pasal 25,
24,Pasal 28,Asas perkawinan menghendaki adanya persetujuan bebas dan calon suami dan calon istri.
25,Pasal 29,"Laki-laki yang belum mencapai umur delapan belas tahun penuh dan perempuan yang belum mencapai umur lima belas tahun penuh, tidak diperkenankan mengadakan perkawinan. Namun jika ada alasan-alasan penting, Presiden dapat menghapuskan larangan ini dengan memberikan dispensasi."
26,Pasal 30,"Perkawinan dilarang antara mereka yang satu sama lainnya mempunyai hubungan darah dalam garis ke atas maupun garis ke bawah, baik karena kelahiran yang sah maupun karena kelahiran yang tidak sah, atau karena perkawinan; dalam garis ke samping, antara kakak beradik laki perempuan, sah atau tidak sah."
27,Pasal 31 Juga dilarang perkawinan:,
28,Pasal 32,"Seseorang yang dengan keputusan pengadilan telah dinyatakan melakukan zina, sekali-kali tidak diperkenankan kawin dengan pasangan zinanya itu."
29,Pasal 33,"Antara orang-orang yang perkawinannya telah dibubarkan sesuai dengan ketentuan Pasal 199 nomor 3° atau 4°, tidak diperbolehkan untuk kedua kalinya dilaksanakan perkawinan kecuali setelah lampau satu tahun sejak pembubaran perkawinan mereka yang didaftarkan dalam daftar Catatan Sipil. Perkawinan lebih lanjut antara orang-orang yang sama dilarang."
30,Pasal 34,"Seorang perempuan tidak diperbolehkan melakukan perkawinan baru, kecuali setelah lampau jangka waktu tiga ratus hari sejak pembubaran perkawinan yang terakhir."
31,Pasal 35,"Untuk melaksanakan perkawinan, anak sah di bawah umur memerlukan izin kedua orang tuanya. Akan tetapi bila hanya salah seorang dan mereka memberi izin dan yang lainnya telah dipecat dan kekuasaan orang tua atau perwalian atas anak itu, maka Pengadilan Negeri di daerah tempat tinggal anak itu, atas permohonannya, berwenang memberi izin melakukan perkawinan itu, setelah mendengar atau memanggil dengan sah mereka yang izinnya menjadi syarat beserta keluarga sedarah atau keluarga-keluarga semenda. Bila salah satu orang tua telah meninggal atau berada dalam keadaan tak mampu menyatakan kehendaknya, maka izin cukup diperoleh dan orang tua yang lain."
32,Pasal 36,"Selain izin yang diharuskan dalam pasal yang lalu, anak-anak sah yang belum dewasa memerlukan juga izin dan wali mereka, bila yang melakukan perwalian adalah orang lain daripada bapak atau ibu mereka; bila izin itu diperbolehkan untuk kawin dengan wali itu atau dengan salah satu dan keluarga sedarahnya dalam garis lurus, diperlukan izin dan wali pengawas."
33,Pasal 37,
34,Pasal 38,"Bila bapak dan ibu serta kakek dan nenek si anak tidak ada, atau bila mereka semua berada dalam keadaan tak mampu menyatakan kehendak mereka, anak sah yang masih di bawah umur tidak boleh melakukan perkawinan tanpa izin wali dan wali pengawasnya."
35,Pasal 39,"Anak luar kawin yang diakui sah, selama masih di bawah umur, tidak boleh melakukan perkawinan tanpa izin bapak dan ibu yang mengakuinya, sejauh kedua-duanya atau salah seorang masih hidup dan tidak berada dalam keadaan tak mampu menyatakan kehendak mereka."
36,Pasal 40,"Anak tidak sah yang tidak diakui, tidak boleh melakukan perkawinan tanpa izin wali atau wali pengawas, selama ia masih di bawah umur. Bila kedua-keduanya, atau salah seorang, menolak untuk memberikan izin atau untuk menyatakan pendirian, Pengadilan Negeri di daerah hukum tempat tinggal anak yang masih di bawah umur itu, atas permohonannya, berkuasa"
37,Pasal 41,"Penetapan-penetapan Pengadilan Negeri dalam hal-hal yang termaksud dalam enam pasal yang lalu, diberikan tanpa bentuk hukum acara. Penetapan-penetapan itu, baik yang mengabulkan permohonan izin, maupun yang menolak, tidak dapat dimohonkan banding."
38,Pasal 42,"Anak sah yang telah dewasa, tetapi belum genap tiga puluh tahun, juga wajib untuk memohon izin bapak dan ibunya untuk melakukan perkawinan. Bila ia tidak memperoleh izin itu, Ia boleh memohon perantaraan Pengadilan Negeri tempat tinggalnya dan dalam hal itu harus diindahkan ketentuan-ketentuan dalam pasal-pasal berikut."
39,Pasal 43,"Dalam waktu tiga minggu, atau dalam jangka waktu yang lain jika dianggap perlu oleh Pengadilan Negeri, terhitung dari hari pengajuan surat permohonan itu, Pengadilan harus berusaha menghadapkan bapak dan ibu, beserta anak itu, agar dalam suatu sidang tertutup kepada mereka diberi penjelasan-penjelasan yang dianggap berguna oleh pengadilan demi kepentingan masing-masing. Mengenai pertemuan pihak-pihak tersebut harus dibuat berita acara tanpa mencantumkan alasan-alasan yang mereka kemukakan."
40,Pasal 44,"Bila baik pihaknya maupun ibunya tidak hadir, perkawinan dapat dilangsungkan dengan penunjukan akta yang memperlihatkan ketidakhadiran itu."
41,Pasal 45,"Bila anak itu tidak hadir, maka perkawinannya tidak dapat dilaksanakan, kecuali sesudah permohonan diajukan sekali lagi untuk perantaraan pengadilan."
42,Pasal 46,"Bila, sesudah anak itu dan kedua orang tuanya atau salah satu orang tua hadir, kedua orang tua itu atau salah seorang tetap menolak, maka perkawinan tidak boleh dilaksanakan bila belum lampau tiga bulan terhitung dari hari pertemuan itu."
43,Pasal 47,
44,Pasal 48,"Sekiranya kedua orang tua atau salah satu tidak berada di Indonesia, Presiden berkuasa memberi dispensasi dan kewajiban-kewajiban yang tercantum dalam Pasal 42 sampai dengan Pasal 47"
45,Pasal 49,"Dalam pengertian ketidakmungkinan bagi para orang tua atau para kakek nenek untuk memberi izin kepada anak di bawah umur untuk melakukan perkawinan, dalam hal-hal yang diatur dalam Pasal 35,37 dan 39, sekali-kali tidak termasuk ketidakhadiran terus-menerus atau sementara di Indonesia."
46,Pasal 51,"Pemberitahuan ini harus dilakukan, baik secara langsung, maupun dengan surat yang dengan cukup jelas memperlihatkan niat kedua calon suami-istri, dan tentang pemberitahuan itu harus dibuat sebuah akta oleh Pegawai Catatan Sipil."
47,Pasal 52,"Sebelum pelaksanaan perkawinan itu, Pegawai Catatan Sipil harus mengumumkan hal itu dan menempel surat pengumuman pada pintu utama gedung tempat penyimpanan daftar-daftar Catatan Sipil itu. Surat itu harus tetap tertempel selama sepuluh hari. Pengumuman itu tidak boleh dilangsungkan pada hari Minggu yang disamakan dengan hari Minggu dalam hal ini ialah hari Tahun Baru, hari Paskah kedua dan Pantekosta, hari Natal, hari Kenaikan Isa Almasih, dan hari Mi'raj Nabi Muhammad s. a. w."
48,Pasal 53,
49,Pasal 54,"Bila calon suami isteri belum sampai enam bulan penuh bertempat tinggal dalam daerah suatu Catatan Sipil, pengumumannya harus juga dilakukan oleh Pegawai Catatan Sipil di tempat tinggal mereka yang terakhir. Bila ada alasan-alasan yang penting dan kewajiban membuat pengumuman tersebut di atas boleh diberikan dispensasi oleh Kepala Pemerintahan Daerah yang di daerahnya telah dilakukan pemberitahuan kawin."
50,Pasal 55,Dihapus dengan S. 916 - 338 jo. 1917 - 18.
51,Pasal 56,Dihapus dengan S. 916 - 338 jo. 1917 - 18.
52,Pasal 57,"Bila perkawinan itu belum dilangsungkan dalam waktu satu tahun, terhitung dari waktu pengumuman, perkawinan itu tidak boleh dilangsungkan, kecuali bila sebelumnya diadakan pengumuman lagi."
53,Pasal 58,"Janji kawin tidak menimbulkan hak untuk menuntut di muka Hakim berlangsungnya perkawinan, juga tidak menimbulkan hak untuk menuntut penggantian biaya, kerugian dan bunga, akibat tidak dipenuhinya janji itu, semua persetujuan untuk ganti rugi dalam hal ini adalah batal."
54,Pasal 60,
55,Pasal 61,Bapak dan ibu dapat mencegah perkawinan dalam hal-hal:
56,Pasal 62,"Dalam hal kedua orang tua tidak ada, maka kakek nenek dan wali atau wali pengawas, bila yang disebut terakhir ini harus mengganti si wali, berhak untuk mencegah perkawinan dalam hal-hal seperti yang tercantum dalam nomor 3, 4, 5 dan 6° pasal yang lalu."
57,Pasal 63,"Dalam hal kakek nenek tidak ada, maka saudara laki-laki dan perempuan, paman dan bibi, demikian pula wali dan wali pengawas, pengampu dan pengampu pengawas, berhak mencegah perkawinan:"
58,Pasal 64,"Suami yang perkawinannya telah bubar karena perceraian, boleh mencegah perkawinan bekas isterinya, bila dia hendak kawin lagi sebelum lampau tiga ratus hari sejak pembubaran perkawinan yang dulu."
59,Pasal 65,Kejaksaan wajib mencegah perkawinan yang hendak dilangsungkan dalam hal-hal yang tercantum dalam Pasal 27 sampai dengan 34.
60,Pasal 66,"Pencegahan perkawinan ditangani oleh Pengadilan Negeri, yang di daerah hukumnya terletak tempat kedudukan Pegawai Catatan Sipil yang harus melangsungkan perkawinan itu."
61,Pasal 67,"Dalam akta pencegahan harus disebutkan segala alasan yang dijadikan dasar pencegahan itu, dan tidak diperkenakan mengajukan alasan baru, sejauh hal itu tidak timbul setelah pencegahan."
62,Pasal 68,Dihapus dengan S. 1937 - 595.
63,Pasal 69,"Bila pencegahan itu ditolak, para penentang boleh dikenakan kewajiban mengganti biaya, kerugian dan bunga, kecuali jika penentang itu adalah keluarga sedarah dalam garis ke atas dan garis ke bawah atau Kejaksaan."
64,Pasal 70,"Bila terjadi pencegahan perkawinan. Pegawai Catatan Sipil tidak diperkenankan untuk melaksanakan perkawinan itu, kecuali setelah kepadanya disampaikan suatu putusan pengadilan yang telah mendapat kekuatan hukum tetapi atau suatu akta otentik dengan mana pencegahan itu ditiadakan pelanggaran atas ketentuan ini kena ancaman hukuman penggantian biaya, kerugian dan bunga."
65,Pasal 72,"Jika di antara calon suami istri yang tidak dapat memperlihatkan akta kelahiran seperti yang disyaratkan pada nomor 1° pasal yang lalu, maka hal ini dapat diganti dengan akta tanda kenal lahir yang dikeluarkan oleh Kepala Pemerintahan Daerah tempat lahir atau tempat tinggal calon suami atau istri atas keterangan dua saksi laki-laki atau perempuan, keluarga atau bukan keluarga. Keterangan ini harus menyebutkan tempat dan waktu kelahirannya secermat mungkin, serta sebab-sebab yang menghalanginya untuk menunjukkan akta kelahiran."
66,Pasal 73,"Bila para pihak tidak dapat memperlihatkan akta kematian yang disebut dalam Pasal 71 nomor 5°, maka kekurangan itu dapat diperbaiki dengan cara yang sama seperti yang tercantum dalam pasal yang lalu."
67,Pasal 74,"Bila Pegawai Catatan Sipil menolak untuk melangsungkan perkawinan atas dasar tidak lengkapnya surat-surat dan keterangan-keterangan yang diharuskan oleh pasal-pasal yang lalu, maka pihak-pihak yang berkepentingan berhak mengajukan surat permohonan kepada Pengadilan Negeri; setelah mendengar Kejaksaan,bila ada alasan untuk itu,dan mendengar Pegawai Catatan Sipil,Pengadilan negeri itu secara singkat dan tanpa kemungkinan untuk banding,akan mengambil keputusan tentang lengkap atau tidak lengkapnya surat-surat."
68,Pasal 75,"Perkawinan tidak boleh dilangsungkan, sebelum hari kesepuluh setelah hari pengumuman, di mana hari itu sendiri tidak termasuk. Jika ada alasan penting Kepala Pemerintahan Daerah, yang di daerahnya telah dilakukan pemberitahuan kawin, berkuasa memberikan dispensasi dan"
69,Pasal 76,"Perkawinan harus dilaksanakan di muka umum, dalam gedung tempat membuat akta Catatan Sipil, di hadapan Pegawai Catatan Sipil tempat tinggal salah satu pihak dan dihadapan dua orang saksi, baik keluarga maupun bukan keluarga, yang telah mencapai umur dua puluh satu tahun dan berdiam di Indonesia."
70,Pasal 77,"Bila salah satu pihak karena halangan yang terbukti cukup sah, tidak dapat pergi ke gedung tersebut, perkawinan boleh dilangsungkan dalam sebuah rumah khusus di daerah Pegawai Catatan Sipil yang bersangkutan. Jika terjadi hal yang demikian, maka dalam akta perkawinan harus dicantumkan sebab-sebab terjadinya. Penilaian tentang sah tidaknya halangan tersebut dalam pasal ini, diserahkan kepada Pegawai Catatan Sipil itu."
71,Pasal 78,Kedua calon suami istri harus datang secara pribadi menghadap Pegawai Catatan Sipil itu.
72,Pasal 79,"Jika ada alasan-alasan penting. Presiden berkuasa untuk mengizinkan pihak-pihak yang bersangkutan melangsungkan perkawinan mereka dengan menggunakan seorang wakil yang khusus diberi kuasa penuh dengan akta otentik. Bila pemberi kuasa itu, sebelum perkawinan dilaksanakan, telah kawin dengan orang lain secara sah, maka perkawinan yang telah berlangsung dengan wakil khusus dianggap tidak pernah terjadi."
73,Pasal 80,"Kedua calon suami istri, di hadapan Pegawai Catatan Sipil dan dengan kehadiran para saksi, harus menerangkan bahwa yang satu menerima yang lain sebagai suami atau istrinya, dan bahwa dengan ketulusan hati mereka akan memenuhi kewajiban mereka, yang oleh undang- undang ditugaskan kepada mereka sebagai suami istri."
74,Pasal 81,"Tidak ada upacara keagamaan yang boleh diselenggarakan, sebelum kedua pihak membuktikan kepada pejabat agama mereka bahwa perkawinan di hadapan Pegawai Catatan Sipil telah berlangsung."
75,Pasal 82,"Jika terjadi pelanggaran oleh Pegawai Catatan Sipil atas ketentuan-ketentuan dalam bab ini, maka selama hal itu tidak diatur dalam aturan undang-undang hukum pidana, para Pegawai itu boleh dihukum oleh Pengadilan Negeri dengan denda uang yang tidak melebihi seratus rupiah, tanpa mengurangi hak pihak-pihak yang berkepentingan untuk menuntut ganti rugi, bila ada alasan untuk itu."
76,Pasal 84,"Dalam waktu satu tahun setelah kembalinya suami istri ke wilayah Indonesia, akta tentang perkawinan mereka di luar negeri harus didaftarkan dalam daftar umum perkawinan di tempat tinggal mereka."
77,Pasal 87,"Keabsahan suatu perkawinan yang berlangsung tanpa persetujuan bekas kedua suami istri atau salah seorang dari mereka, hanya dapat dibantah oleh suami istri itu, atau oleh salah seorang dari mereka yang memberikan persetujuan secara tidak bebas."
78,Pasal 88,
79,Pasal 89,"Bila perkawinan dilakukan oleh orang yang belum mencapai umur yang disyaratkan dalam Pasal 29, maka pembatalan perkawinan itu boleh dituntut, baik oleh orang yang belum cukup umur itu, maupun oleh Kejaksaan. Namun keabsahan perkawinan itu tidak dapat dibantah:"
80,Pasal 90,"Semua perkawinan yang dilakukan dengan melanggar ketentuan-ketentuan dalam pasal-pasal 30, 31, 32 dan 33, boleh dimintakan pembatalan, baik oleh suami istri itu sendiri, maupun oleh orang tua mereka atau keluarga sedarah mereka dalam garis ke atas, atau oleh siapa pun yang mempunyai kepentingan dengan pembatalan itu, ataupun oleh Kejaksaan."
81,Pasal 91,"Bila suatu perkawinan dilaksanakan tanpa izin bapak, ibu, kakek, nenek, wali atau wali pengawas, maka dalam hal izin harus diperoleh ataupun wali harus didengar menurut pasal- pasal 36, 37, 38, 39 dan 40, pembatalan perkawinan hanya boleh dituntut oleh orang yang harus diperoleh izinnya atau harus didengar menurut undang-undang."
82,Pasal 92,"Perkawinan yang dilangsungkan tidak dihadapan Pegawai Catatan Sipil yang berwenang dan tanpa kehadiran sejumlah saksi yang disyaratkan, dapat dimintakan pembatalannya oleh suami istri itu, oleh bapak, ibu, dan keluarga sedarah lainnya dalam garis ke atas, dan juga oleh wali, wali pengawas, dan oleh siapa pun yang berkepentingan dalam hal itu, dan akhirnya oleh Kejaksaan."
83,Pasal 93,"Dalam segala hal di mana sesuai dengan pasal-pasal 85, 90 dan 92 suatu tuntutan hukum pernyataan batal dapat dimulai oleh orang yang mempunyai kepentingan dalam ha! itu, yang demikian tidak dapat dilakukan oleh kerabat sedarah dalam garis ke samping oleh anak dari perkawinan lain, atau oleh orang-orang luar, selama suami istri itu kedua-duanya masih hidup, dan tuntutan boleh diajukan hanya bila mereka dalam hal itu telah memperoleh atau akan segera memperoleh kepentingan."
84,Pasal 94,"Setelah perkawinan dibubarkan, Kejaksaan tidak boleh menuntut pembatalannya."
85,Pasal 95,"Suatu perkawinan, walaupun telah dinyatakan batal, mempunyai segala akibat perdatanya, baik terhadap suami isteri, maupun terhadap anak-anak mereka, bila perkawinan itu dilangsungkan dengan itikad baik oleh kedua suami isteri itu."
86,Pasal 96,"Bila itikad baik hanya ada pada salah seorang dan suami isteri, maka perkawinan itu hanya mempunyai akibat-akibat perdata yang menguntungkan pihak yang beritikad baik itu dan bagi anak-anak yang lahir dan perkawinan itu. Suami atau isteri yang beritikad buruk boleh dijatuhi hukuman mengganti biaya, kerugian dan bunga terhadap pihak yang lain."
87,Pasal 97,"Dalam ha! tersebut dalam dua pasal yang lalu, perkawinan itu berhenti mempunyai akibat- akibat perdata, terhitung sejak hari perkawinan itu dinyatakan batal."
88,Pasal 98,"Batalnya suatu perkawinan tidak boleh merugikan pihak ketiga, bila dia telah berbuat dengan itikad baik dengan suami istri itu."
89,Pasal 99,"Tiada suatu perkawinan pun yang harus batal bila terjadi pelanggaran terhadap ketentuan- ketentuan pasal-pasal 34,42,46,52, dan 75, atau, kecuali apa yang diatur dalam Pasal 77, bila perkawinan itu dilangsungkan tidak di muka umum dalam gedung tempat akta-akta Catatan Sipil dibuat. Dalam hal-hal itu berlakulah ketentuan Pasal 82 bagi Pegawai-pegawai Catatan Sipil."
90,Pasal 99a,
91,Pasal 101,"Bila ternyata bahwa daftar-daftar itu tidak pernah ada, atau telah hilang, atau akta perkawinan itu tidak terdapat di dalamnya, maka penilaian tentang cukup tidaknya bukti-bukti tentang adanya perkawinan diserahkan kepada Hakim, asalkan kelihatan jelas adanya hubungan selaku suami isteri."
92,Pasal 102,"Keabsahan seorang anak yang tidak dapat memperlihatkan akta perkawinan orang tuanya yang sudah meninggal, tidak dapat dibantah, bila dia telah memperlihatkan kedudukannya sebagai anak sesuai dengan akta kelahirannya, dan orang tuanya telah hidup secara jelas sebagai suami- isteri."
93,Pasal 104,"Suami isteri, dengan hanya melakukan perkawinan, telah saling mengikatkan diri untuk memelihara dan mendidik anak mereka."
94,Pasal 105,
95,Pasal 106,"Setiap isteri harus patuh kepada suaminya. Dia wajib tinggal serumah dengan suaminya dan mengikutinya, di mana pun dianggapnya perlu untuk bertempat tinggal."
96,Pasal 107,"Setiap suami wajib menerima isterinya di rumah yang ditempatinya. Dia wajib melindungi isterinya, dan memberinya apa saja yang perlu, sesuai dengan kedudukan dan kemampuannya."
97,Pasal 108,"Seorang isteri, sekalipun ia kawin di luar harta bersama, atau dengan harta benda terpisah, tidak dapat menghibahkan, memindahtangankan, menggadaikan, memperoleh apa pun, baik secara cuma-cuma maupun dengan beban, tanpa bantuan suami dalam akta atau izin tertulis. Sekalipun suami telah memberi kuasa kepada isterinya untuk membuat akta atau perjanjian tertentu, si isteri tidaklah berwenang untuk menerima pembayaran apa pun, atau memberi pembebasan untuk itu tanpa izin tegas dari suami."
98,Pasal 109,"Mengenai perbuatan atau perjanjian, yang dibuat oleh seorang isteri karena apa saja yang menyangkut perbelanjaan rumah tangga biasa dan sehari-hari, juga mengenai perjanjian perburuhan yang diadakan olehnya sebagai majikan untuk keperluan rumah tangga, undang- undang menganggap bahwa ia telah mendapat persetujuan dan suaminya."
99,Pasal 110,"Isteri tidak boleh tampil dalam pengadilan tanpa bantuan suaminya, meskipun dia kawin tidak dengan harta bersama, atau dengan harta terpisah, atau meskipun dia secara mandiri menjalankan pekerjaan bebas."
100,Pasal 111,Bantuan suami tidak diperlukan:
101,Pasal 112,"Bila suami menolak memberi kuasa kepada isterinya untuk membuat akta, atau menolak tampil di Pengadilan, maka si isteri boleh memohon kepada Pengadilan Negeri di tempat tinggi mereka bersama supaya dikuasakan untuk itu."
102,Pasal 113,"Seorang isteri yang atas usaha sendiri melakukan suatu pekerjaan dengan izin suaminya, secara tegas atau secara diam-diam, boleh mengadakan perjanjian apa pun yang berkenaan dengan usaha itu tanpa bantuan suaminya. Bila ia kawin dengan suaminya dengan penggabungan harta, maka si suami juga terikat pada perjanjian itu. Bila si suami menarik kembali izinnya, dia wajib mengumumkan penarikan kembali itu."
103,Pasal 114,"Bila si suami, karena sedang tidak ada atau karena alasan-alasan lain, terhalang untuk membantu isterinya atau memberinya kuasa, atau bila ia mempunyai kepentingan yang berlawanan, maka Pengadilan Negeri di tempat tinggal suami isteri itu boleh memberikan wewenang kepada si isteri untuk tampil di muka Pengadilan, mengadakan perjanjian, melakukan pengurusan, dan membuat akta-akta lain."
104,Pasal 115,"Pemberian kuasa umum, pun jika dicantumkan pada perjanjian perkawinan, berlaku tidak lebih daripada yang berkenaan dengan pengurusan harta kekayaan si isteri itu sendiri."
