,Pasal,Isi
948,Pasal 986,"Pengangkatan ahli waris dengan wasiat yang pada bagian ini diperkenankan, tidak boleh dipertahankan terhadap pihak ketiga, bahkan oleh anak yang di bawah umur sekalipun, bila hal itu tidak diumumkan, dengan cara berikut: mengenai barang-barang tetap, dengan cara yang ditentukan dalam Pasal 620; dan mengenai piutang-piutang berhipotek, dengan mendaftarkan barang-barang yang terikat untuk piutang-piutang itu atau dengan membubuhkan keterangan di sebelah daftar yang telah ada."
949,Pasal 987,"Ahli waris karena undang-undang atau ahli waris karena surat wasiat dan orang yang mengangkat ahli waris dengan wasiat, dalam hal apa pun tidak boleh mengajukan bantahan kepada ahli waris berharapan berdasarkan tidak adanya pengumuman, pendaftaran atau pembubuhan keterangan seperti yang diperintahkan dalam pasal yang lalu."
950,Pasal 988,"Para pengelola wajib menyelenggarakan pengumuman, pendaftaran dan pembubuhan keterangan seperti yang diperintahkan dalam Pasal 986, yang pelanggarannya diancam dengan hukuman penggantian biaya kerugian dan bunga."
951,Pasal 989,"Dalam hal ada pengangkatan ahli waris atau pemberian hibah wasiat atas dasar yang dicantumkan dalam Pasal 881, ahli waris atau penerima hibah memindahkan atau menghabiskan, dan bahkan berhak menghibahkan barang-barang warisan itu kepada sesama yang masih hidup, kecuali bila hal terakhir ini dilarang oleh pewaris untuk seluruhnya atau untuk sebagian."
952,Pasal 990,"Kewajiban untuk membuat perincian harta peninggalan atau daftar setelah pewaris meninggal, dan kewajiban untuk menyerahkan surat-surat itu kepada kepaniteraan Pengadilan Negeri sebagaimana diatur dalam Pasal 980 dan 981, juga berlaku bagi ahli waris atau penerima hibah yang memikul beban sebagaimana diatur dalam bagian ini, tetapi ia tidak wajib memberikan suatu jaminan."
953,Pasal 991,"Setelah meninggalnya ahi waris atau penerima hibah yang dibebani, ahli waris berharapan berhak menuntut, supaya segala sesuatu yang masih tersisa dari warisan atau hibah wasiat itu segera diserahkan kepadanya dalam wujudnya."
954,Pasal 993,"Bila surat wasiat kemudian itu, yang memuat pencabutan secara tegas wasiat yang terdahulu, tidak dilengkapi dengan formalitas-formalitas yang disyaratkan untuk sahnya surat wasiat, tetapi memenuhi yang disyaratkan untuk sahnya akta Notaris, maka penetapanpenetapan yang dahulu, sekiranya diulangi dalam penetapan yang kemudian, harus dianggap tidak dicabut."
955,Pasal 994,"Surat wasiat kemudian, yang tidak mencabut wasiat terdahulu secara tegas, hanya membatalkan penetapan-penetapan surat wasiat yang terdahulu itu sejauh tidak dapat disesuaikan dengan penetapan-penetapan yang baru, atau bertentangan dengan itu."
956,Pasal 995,"Pencabutan yang dilakukan dengan surat wasiat yang kemudian baik secara tersurat maupun tersirat, berlaku sepenuhnya, pun sekiranya akta yang baru itu tak berlaku karena tidak cakapnya ahli waris atau penerima hibah yang ditetapkan, atau karena penolakan mereka untuk menerima warisan itu."
957,Pasal 996,"Semua pemindahtanganan, bahkan penjualan dengan hak untuk membeli kembali, atau tukar menukar, yang dilakukan oleh pewaris atas barang yang dihibahwasiatkan, seluruhnya atau sebagian, selalu mengakibatkan tercabutnya hibah wasiat yang dipindahtangankan mungkin telah kembali ke dalam harta peninggalan pewaris."
958,Pasal 997,"Semua penetapan dengan surat wasiat yang dibuat dengan persyaratan yang bergantung pada peristiwa yang tidak tentu terjadinya dan sifatnya, sehingga pewaris harus dianggap telah menggantungkan pelaksanaan penetapannya dengan terjadi tidaknya peristiwa itu, adaIah gugur, bila ahli waris atau penerima hibah yang ditetapkan itu meninggal sebelum terpenuhi persyaratan itu."
959,Pasal 998,"Bila dengan persyaratan itu pewaris hanya bermaksud menangguhkan pelaksanaan penetapannya, maka hal yang demikian itu tidak menghalangi ahli waris atau penerima hibah yang ditetapkan itu untuk mempunyai hak yang diperoleh itu, dan untuk mengalihkannya kepada ahli warisnya."
960,Pasal 999,"Suatu hibah wasiat gugur, bila barang yang dihibahwasiatkan musnah sama sekali semasa pewaris masih hidup."
961,Pasal 1000,"Suatu hibah wasiat berupa bunga, piutang atau tagihan utang lain kepada pihak ketiga, gugur sekedar mengenai apa yang pada waktu pewaris masih hidup kiranya telah dibayar."
962,Pasal 1001,
963,Pasal 1002,"Warisan atau hibah wasiat bagi para ahli waris atau penerima hibah menjadi bertambah, dalam hal pengangkatan ahli waris atau pemberian hibah wasiat ditetapkan untuk beberapa orang bersama-sama, bila hal itu dibuat dengan satu penetapan yang sama, dan kepada masing- masing ahli waris atau penerima hibah itu pewaris itu tidak menunjukkan bagian tertentu dan barangnya, seperti seperdua, sepertiga, dan seterusnya. Perkataan ""untuk bagian-bagian sama besar"" tidak dianggap sebagai petunjuk ""bagian tertentu"" seperti yang diatur dalam pasal ini."
964,Pasal 1003,"Selanjutnya pewaris juga harus dianggap telah memberikan hibah wasiat kepada beberapa orang bersama-sama, bila suatu barang yang tidak dapat dibagi-bagi tanpa menjadi rusak, diwasiatkan dalam satu akta yang sama kepada beberapa orang, meskipun diwasiatkan secara sendiri-sendiri."
965,Pasal 1004,"Pernyataan gugurnya surat-surat wasiat dapat diminta setelah meninggalnya pewaris, karena tidak dilaksanakan persyaratan-persyaratannya."
966,Pasal 1005,"Seorang pewaris boleh mengangkat seorang atau lebih pelaksana surat wasiatnya, baik dengan surat wasiat maupun dengan akta di bawah tangan seperti yang tercantum pada Pasal 935, ataupun dengan akta Notaris khusus. Ia dapat juga mengangkat beberapa orang, agar pada waktu yang satu berhalangan, yang lain dapat menggantikannya."
967,Pasal 1006,"Wanita yang telah kawin, anak di bawah umur, sekalipun ia telah memperoleh pendewasaan, orang yang ada di bawah pengampuan, dan siapa saja yang tidak cakap untuk mengadakan ikatan, tidak boleh menjadi pelaksana wasiat."
968,Pasal 1007,"Kepada para pelaksana wasiat, pewaris dapat memberikan penguasaan atas semua barang dari harta peninggalan, atau bagian tertentu daripadanya."
969,Pasal 1008,"Bila semua ahli waris sepakat, mereka dapat menghentikan penguasaan itu, asalkan mereka memungkinkan para pelaksana untuk membayar atau menyerahkan hibah-hibah wasiat yang murni dan tak bersyarat, atau menunjukkan bahwa penyerahan hibah-hibah itu telah dilaksanakan."
970,Pasal 1009,"Pelaksana surat wasiat harus mengusahakan penyegelan harta peninggalannya, bila ada ahli waris yang masih di bawah umur atau ditaruh di bawah pengampuan. yang pada waktu pewaris meninggal tidak mempunyai wali atau pengampu, atau jika ada ahli waris yang tidak hadir, baik sendiri maupun dengan perantaraan."
971,Pasal 1010,Pelaksana wajib mengusahakan pembuatan perincian harta peninggalan itu dihadapan para ahli waris yang ada di Indonesia atau setelah memanggil mereka dengan sah.
972,Pasal 1011,"Pelaksana harus mengusahakan agar kehendak terakhir pewaris dilaksanakan, dan dalam hal terjadi perselisihan mengajukan tuntutan ke pengadilan untuk mempertahankan berlakunya surat wasiatnya."
973,Pasal 1012,"Bila uang tunai yang diperlukan untuk membayar hibah-hibah wasiat tidak tersedia, maka pelaksana mempunyai wewenang untuk mengusahakan penjualan di muka umum dan menurut kebiasaan setempat. atas barang-barang bergerak dari harta peninggalan itu, dan bila perlu, juga satu atau beberapa dari harta tetap, tetapi yang tersebut terakhir haruslah dengan persetujuan para ahli waris, atau bila mereka tidak ada dengan izin Hakim, kecuali bila para ahli waris berkenan untuk membayar lebih dahulu uang yang diperlukan."
974,Pasal 1013,"Para pelaksana yang menguasai harta peninggalan bahkan di muka Hakim pun, berwenang untuk menagih piutang-piutang yang tiba waktunya dan dapat ditagih selama penguasaan."
975,Pasal 1014,"Mereka tidak berwenang untuk menjual barang-barang harta peninggalan dengan maksud untuk melakukan pembagian; pada akhir pengelolaan, mereka wajib memberikan perhitungan dan pertanggungjawaban kepada orang-orang yang berkepentingan, dengan menyerahkan semua barang dan efek yang termasuk harta peninggalan, beserta penutup perhitungannya, agar dapat diadakan pembagian antara para ahli waris. Dalam hal melakukan pembagian, mereka harus membantu para ahli waris, bila para ahli waris ini menghendakinya."
976,Pasal 1015,Kekuasaan pelaksana suatu wasiat tidak beralih kepada ahli warisnya.
977,Pasal 1016,"Bila ada beberapa pelaksana satu surat wasiat yang telah menerima tugas itu, maka masing- masing dapat bekerja sendiri bila yang tidak ada dan mereka masing-masing dalam hal ini bertanggung jawab atas pengelolaan itu, kecuali bila pewaris telah membagi pekerjaan mereka, dan masing-masing harus membatasi diri dalam lingkungan urusan yang diserahkan kepadanya."
978,Pasal 1017,"Biaya yang dikeluarkan oleh pelaksana surat wasiat untuk penyegelan, pemerincian harta, perhitungan dan pertanggungjawaban dan urusan lain yang berhubungan dengan pekerjaan mereka, dibebankan pada harta peninggalan itu."
979,Pasal 1018,"Tiap-tiap ketentuan pewaris yang berisi bahwa pelaksana surat wasiatnya dibebaskan dari pembuatan pemerincian harta peninggalan, atau dari pemberian perhitungan dan pertanggungjawaban, batal menurut hukum."
980,Pasal 1019,"Tanpa mengurangi apa yang telah ditentukan mengenai hak pakai hasil, mengenai penunjukan ahli waris dengan wasiat, dan mengenai anak-anak di bawah umur dan orang-orang yang dalam pengampuan, pewaris boleh mengangkat seorang pengelola atau lebih, dengan surat wasiat atau dengan akta Notaris khusus, untuk mengelola barang-barang yang ditinggalkan kepada para ahli waris dan para penerima hibah wasiat selama hidup mereka ini atau selama waktu tertentu, asalkan dengan itu tidak dilanggar penyerahan secara bebas bagian para ahli waris menurut undang-undang. Ketentuan Pasal 1016 berlaku terhadap hal ini."
981,Pasal 1020,"Bila pewaris tidak menunjuk orang-orang yang akan bertindak sebagai pengganti pengelola yang berhalangan, maka hal ini akan ditetapkan oleh Pengadilan Negeri setelah mendengar jawatan Kejaksaan."
982,Pasal 1021,"Tiada seorang pun diwajibkan untuk menerima tugas pelaksana suatu wasiat atau tugas pengelola warisan atau hibah wasiat, tetapi orang yang telah menerima hal itu wajib"
983,Pasal 1022,"Pelaksana surat wasiat, demikian pula pengelola tersebut pada Pasal 1019, dapat dipecat karena alasan yang sama seperti yang berlaku bagi wali."
984,Pasal 1023,"Barangsiapa memperoleh hak atas suatu warisan dan sekiranya ingin menyelidiki keadaan harta peninggalan itu, agar dapat mempertimbangkan yang terbaik bagi kepentingan mereka, apakah menerima secara murni, ataukah menerima dengan hak istimewa untuk merinci harta peninggalan itu, ataukah menolaknya, mempunyai hak untuk berpikir, dan harus memberikan pernyataan mengenai hal itu pada kepaniteraan Pengadilan Negeri yang dalam daerah hukumnya warisan itu terbuka; pernyataan itu harus didaftarkan dalam daftar yang disediakan untuk itu."
985,Pasal 1024,"Kepada ahli waris tersebut diberikan juga jangka waktu empat bulan, terhitung dari hari pemberian pernyataan, untuk menyuruh pengadaan perincian harta itu dan untuk berpikir."
986,Pasal 1025,"Selama jangka waktu yang ditetapkan itu, ahli waris yang sedang berpikir itu tidak boleh diharuskan bertindak sebagai ahli waris. Terhadapnya tidak dapat dijatuhkan hukuman oleh Pengadilan, dan pelaksanaan putusan-putusan Hakim terhadap pewaris tetap ditangguhkan. Ia berkewajiban untuk bertindak sebagai seorang kepala rumah tangga yang baik dalam menjaga harta peninggalan itu."
987,Pasal 1026,"Ahli waris yang sedang berpikir itu berwenang minta izin kepada Hakim untuk menjual semua benda yang tidak perlu atau tidak dapat disimpan, serta untuk melakukan segala macam tindakan yang tidak dapat ditunda."
988,Pasal 1027,"Atas kepentingan orang-orang yang berkepentingan, Hakim dapat memerintahkan tindakan- tindakan yang dianggapnya perlu diambil, baik untuk keselamatan barang-barang harta peninggalan maupun untuk kepentingan pihak ketiga."
989,Pasal 1028,"Di tempat-tempat seperti yang dimaksud dalam penutup Pasal 1023 Kepala Pemerintahan Daerah setempat mempunyai wewenang yang dalam pasal lalu diberikan kepada Hakim, dan kepada pejabat tersebut dapat dimintakan izin termaksud dalam Pasal 1026."
990,Pasal 1029,"Setelah lampau jangka waktu yang ditentukan dalam Pasal 1024, ahli waris dapat dipaksa untuk menolak warisan itu, atau menerimanya, baik secara murni maupun dengan hak istimewa untuk merinci harta peninggalan itu. Dalam hal yang terakhir ini, harus diberikan pernyataan dengan cara yang sama seperti yang ditetapkan dalam Pasal 1023."
991,Pasal 1030,"Setelah habisnya jangka waktu itu pun, ahli waris masih berhak menyuruh mengadakan perincian harta peninggalan itu, dan untuk menerimanya, dengan hak istimewa untuk membuat perincian, kecuali bila dia bertindak sebagai ahli waris murni."
992,Pasal 1031,"Ahli waris kehilangan hak istimewa pemerincian, dan dianggap sebagai ahli waris murni:"
993,Pasal 1032,Hak istimewa untuk mengadakan pemerincian mempunyai akibat:
994,Pasal 1033,"Ahli waris yang telah menerima warisan dengan hak istimewa untuk mengadakan pemerincian, wajib mengurus barang-barang yang termasuk warisan itu sebagai seorang kepala rumah tangga yang baik, dan secepatnya menyelesaikan urusan warisan itu; ia wajib memberi pertanggungjawaban kepada para kreditur dan penerima hibah wasiat."
995,Pasal 1035,"Bila para kreditur dan orang-orang lain yang berkepentingan menghendaki, ia wajib memberikan jaminan secukupnya untuk harga barang-barang bergerak yang termasuk dalam perincian harta peninggalan itu, dan untuk bagian dari harga barang-barang tetap yang tidak diserahkan kepada para kreditur hipotek."
996,Pasal 1036,"Dalam waktu tiga bulan, terhitung dari Iampaunya jangka waktu yang ditentukan dalam Pasal 1024, ahli waris itu wajib memanggil para kreditur yang tidak diketahui dengan pengumuman dalam berita negara, agar kepada mereka, kepada kreditur yang telah diketahui, serta kepada para penerima hibah wasiat, dapat diberikan segera perhitungan dan pertanggungjawaban tentang pengelolaannya, dan agar dapat dilunasi piutang-piutang dan hibah-hibah mereka sekedar jumlah harta peninggalan mencukupi."
997,Pasal 1037,"Setelah menyelesaikan perhitungan dan pertanggungjawaban, ahli waris harus melunasi piutang para kreditur yang sudah diketahui pada waktu itu, seluruhnya atau dalam perbandingan dengan jumlah harta peninggalan itu."
998,Pasal 1038,"Bila terjadi perlawanan, piutang para kreditur tidak dapat dilunasi, kecuali berdasarkan tata tertib urutan yang ditetapkan oleh Hakim."
999,Pasal 1039,"Para penerima hibah wasiat tidak dapat menuntut bagian hibah wasiat mereka, bila belum lewat jangka waktu yang telah ditentukan dalam Pasal 1036, dan belum dilakukan pembayaran yang ditentukan dalam Pasal 1037."
1000,Pasal 1040,"Ahli waris yang telah menerima warisan dengan hak istimewa untuk mengadakan pendaftaran harta, tidak dapat diminta untuk menanggung utang-utang pewaris terlebih dahulu dengan hartanya sendiri, kecuali jika setelah diperingatkan untuk memberikan perhitungan, ia masih tetap lalai untuk memenuhi kewajibannya itu."
1001,Pasal 1041,"Biaya penyegelan, pemerincian harta peninggalan, pembuatan perhitungan, beserta semua biaya lainnya yang telah dikeluarkan secara sah, dibebankan kepada harta peninggalan itu."
1002,Pasal 1042,"Ketentuan-ketentuan dari Pasal 1024, Pasal 1031 dan berikutnya juga berlaku bagi ahli waris yang menggunakan hak untuk berpikir, telah menerima warisan dengan hak istimewa untuk mengadakan pemerincian harta peninggalan, dengan memberikan pernyataan seperti yang tersebut dalam penutup pasal 1029."
1003,Pasal 1043,"Suatu ketentuan pewaris melarang untuk menggunakan hak berpikir dan hak istimewa untuk mengadakan pemerincian harta peninggalan, adalah batal dan tidak berlaku."
1004,Pasal 1045,Tiada seorang pun diwajibkan untuk menerima warisan yang jatuh ke tangannya.
1005,Pasal 1046,"Warisan yang jatuh ke tangan wanita yang telah kawin, anak di bawah umur dan orang yang berada dalam pengampuan tidak dapat diterima secara sah, kecuali dengan mengindahkan ketentuan undang-undang mengenai orang-orang itu. Pengangkatan ahli waris yang disebut"
1006,Pasal 1047,Penerima suatu warisan berlaku surut sampai pada hari warisan itu terbuka.
1007,Pasal 1048,"Penerimaan suatu warisan dilakukan dengan tegas atau secara diam-diam; hal itu dilakukan dengan tegas, bila seseorang, dalam surat otentik atau di bawah tangan, menamakan dirinya ahli waris atau mengambil kedudukan ahli waris; kesediaan menerima itu dilakukan secara diam-diam, bila ahli waris itu melakukan suatu perbuatan yang menunjukkan maksudnya untuk menerima warisan itu, dan dia kiranya hanya berwenang untuk itu dalam kedudukannya sebagai ahli waris."
1008,Pasal 1049,"Segala sesuatu yang berhubungan dengan pemakaman, tindakan-tindakan yang hanya untuk penyimpanan saja, demikian pula yang hanya bertujuan untuk mengawasi harta peninggalan itu atau untuk mengelolanya sementara, tidak dianggap sebagai tindakan-tindakan yang menunjukkan kesediaan untuk menerima warisan secara diam-diam."
1009,Pasal 1050,"Bila para ahli waris berselisih pendapat tentang menerima warisan atau tidak, maka yang satu dapat menerima, sedangkan yang lain dapat menolak. Bila para ahli waris itu berselisih pendapat tentang cara menerima warisan, maka warisan itu diterima dengan hak istimewa untuk mengadakan pemerincian."
1010,Pasal 1051,"Bila seseorang yang ke tangannya telah jatuh suatu warisan, meninggal tanpa menolak atau menerima, maka para ahli warisnya berwenang sebagai penggantinya untuk menerima atau menolak, dan ketentuan-ketentuan pasal yang lalu berlaku terhadap mereka."
1011,Pasal 1052,"Barangsiapa telah bersedia menerima bagiannya dari suatu warisan, tidak diperkenankan menolak baginya yang telah jatuh ke tangannya karena hak pertambahan, kecuali dalam hal yang diatur dalam pasal 1054."
1012,Pasal 1053,"Kesediaan orang dewasa menerima suatu warisan, tidak dapat dibatalkan seluruhnya, kecuali jika kesediaannya itu terjadi akibat paksaan atau penipuan yang dilakukan terhadapnya. Ia tidak dapat mengingkari penerimaan itu dengan alasan bahwa ia telah dirugikan karenanya, kecuali jika warisannya telah dikurangi separuh lebih karena telah ditemukan suatu wasiat yang tidak diketahui pada waktu diterimanya warisan itu."
1013,Pasal 1054,
1014,Pasal 1055,"Hak untuk menerima warisan lewat waktu dengan lampaunya 30 tahun, terhitung dari hari warisan itu terbuka, asalkan sebelum atau sesudah lampaunya waktu itu warisan itu telah diterima oleh orang yang karena undang-undang atau karena surat wasiat mendapat hak untuk itu; tetapi hal ini tidak mengurangi hak-hak pihak ketiga atas harta peninggalan itu, yang diperoleh berdasarkan suatu alas hak yang sah."
1015,Pasal 1056,"Para ahli waris yang telah menolak warisan itu, masih dapat menyatakan bersedia menerima, selama warisan itu belum diterima oleh orang yang mendapat hak untuk itu dari undang- undang atau dari surat wasiat, tanpa mengurangi hak-hak pihak ketiga, seperti yang ditentukan dalam pasal yang lalu."
1016,Pasal 1058,"Ahli waris yang menolak warisan, dianggap tidak pernah menjadi ahli waris."
1017,Pasal 1059,"Bagian warisan dari orang yang menolak warisan jatuh ke tangan orang yang sedianya berhak atas bagian itu, andaikata orang yang menolak itu tidak ada pada waktu pewaris meninggal."
1018,Pasal 1060,"Orang yang telah menolak warisan sekali-kali tidak dapat diwakili dengan penggantian ahli waris bila ia itu satu-satunya ahli waris dalam derajatnya, atau bila semua ahli waris menolak warisannya, maka anak-anak mereka menjadi ahli waris karena diri mereka sendiri dan mewarisi bagian yang sama."
1019,Pasal 1061,"Para kreditur yang dirugikan oleh debitur yang menolak warisannya, dapat mengajukan permohonan kepada Hakim, supaya diberi kuasa untuk menerima warisan itu atas nama dan sebagai pengganti debitur itu. Dalam hal itu, penolakkan warisan itu hanya boleh dibatalkan demi kepentingan para kreditur dan sampai sebesar piutang mereka, penolakkan itu sekali-kali tidak batal untuk keuntungan ahli waris yang telah menolak warisan itu."
1020,Pasal 1062,Wewenang untuk menolak warisan tidak dapat hilang karena lewat waktu.
1021,Pasal 1063,"Sekalipun dengan perjanjian perkawinan, seseorang tidak dapat melepaskan diri dari warisan seseorang yang masih hidup, atau pun mengalihtangankan hak-hak yang akan diperolehnya atas warisan demikian itu dikemudian hari."
1022,Pasal 1064,"Ahli waris yang menghilangkan atau menyembunyikan barang-barang yang termasuk harta peninggalan, kehilangan wewenang untuk menolak warisannya; ia tetap sebagai ahli waris murni, meskipun ia menolak, dan tidak boleh menuntut suatu bagian pun dari barang yang dihilangkan atau disembunyikannya."
1023,Pasal 1065,"Tiada seorang pun dapat seluruhnya dipulihkan kembali dari penolakkan suatu warisan, kecuali bila penolakkan itu terjadi karena penipuan atau paksaan."
1024,Pasal 1067,"Orang-orang yang berpiutang terhadap pewaris, demikian pula para penerima hibah wasiat, berhak untuk menentang pemisahan harta peninggalan. Akta pemisahan harta peninggalan yang dibuat setelah diajukan perlawanan demikian dan sebelum dilunasi apa yang selama perlawanan itu tiba waktunya dan dapat ditagih oleh orang yang berpiutang dan penerima hibah wasiat adalah batal."
1025,Pasal 1068,
1026,Pasal 1069,"Bila semua ahli waris dapat bertindak bebas terhadap harta benda mereka dan mereka hadir, maka pemisahan harta peninggalan dapat dilaksanakan dengan cara dan dengan akta yang mereka anggap baik."
1027,Pasal 1070,"Pemisahan harta peninggalan tidak dapat diminta atas nama orang-orang yang tidak dapat bertindak bebas terhadap harta benda mereka, kecuali dengan mengindahkan ketentuan undang-undang mengenai orang-orang demikian."
1028,Pasal 1071,"Jika satu atau beberapa orang yang berkepentingan menolak atau lalai untuk membantu melaksanakan pemisahan harta benda setelah diperintahkan oleh Hakim, maka atas permohonan orang yang paling berkepentingan, dapat diperintahkan oleh Pengadilan Negeri (jika hal itu belum dicantumkan dalam putusan Hakim), agar Balai Harta Peninggalan mewakili mereka yang enggan atau lalai itu dan mengelola apa yang mereka terima semuanya berdasarkan Bagian 1 dan Bab 13 Buku Pertama."
1029,Pasal 1072,"Pada pelaksanaan pemisahan harta peninggalan harus hadir Balai Harta Peninggalan, sebagaimana diatur dalam pasal 417 alinea pertama kitab hukum ini, beserta wali pengawas dan pengampu pengawas, bila Balai Harta Peninggalan tidak diserahi tugas perwalian dan pengampu pengawas."
1030,Pasal 1073,"Bila belum ada perincian harta peninggalan, maka hal itu harus diadakan sebelumnya dalam akta tersendiri, atau sekaligus dengan pemisahan harta itu dalam akta itu juga, sesuai dengan peraturan undang-undang."
1031,Pasal 1074,"Pemisahan harta itu harus dibuat dalam satu akta dihadapan Notaris yang dipilih oleh pihak yang berkepentingan, atau bila ada perselisihan, diangkat oleh Pengadilan Negeri atas permohonan pihak-pihak yang berkepentingan yang paling siap."
1032,Pasal 1075,"Bila Balai Harta Peninggalan menolak memberikan persetujuannya pada pemisahan harta peninggalan yang telah dirancang, sedangkan para ahli waris dan wakil-wakil mereka (sejauh perwakilan itu tidak diserahkan kepada Balai Harta Peninggalan) berpendapat, bahwa penolakan itu tidak mempunyai dasar, maka Balai Harta Peninggalan harus memberitahukan alasan-alasannya, dan hal itu dicantumkan dalam berita acara yang harus dibuat oleh Notaris."
1033,Pasal 1076,"Bila para ahli waris, atau seorang atau beberapa orang dan mereka, berpendapat bahwa barang- barang tetap dan harta peninggalan itu atau beberapa di antaranya harus dijual, baik untuk kepentingan harta peninggalan itu, untuk membayar utang-utang dan sebagainya, maupun untuk dapat menyelenggarakan pembagian yang baik, maka Pengadilan Negeri setelah mendengar pihak-pihak lain yang berkepentingan atau setelah memanggil mereka secukupnya, dapat memerintahkan penjualan itu sesuai dengan ketentuan-ketentuan Reglemen Acara"
1034,Pasal 1077,"Penilaian barang-barang yang dalam harta peninggalan itu pada waktu dilaksanakan pemisahan harta peninggalan, diadakan sebagai berikut:"
1035,Pasal 1078,"Ahh-ahli tersebut diangkat oleh mereka yang berkepentingan, atau bila ada perselisihan, atas surat permohonan si berkepentingan yang paling siap, oleh Pengadilan Negeri yang dalam daerah hukumnya warisan itu terbuka, dan sejauh mengenai penilaian barang-barang tetap, oleh Pengadilan Negeri yang dalam daerah hukumnya barang itu terletak."
1036,Pasal 1079,"Setelah diatur pemasukan dan utang harta peninggalan yang harus dibayar kepada seorang ahli waris atau Iebih atas dasar apa pun juga, maka sisa harta peninggalan itu dan bagian dan tiap- tiap ahli waris atau pancang ditentukan."
1037,Pasal 1080,"Setelah undian, para ahli waris berhak untuk bertukar kapling yang dengan undian menjadi bagian mereka, asalkan hal itu terjadi sebelum penutupan akta pemisahan harta peninggalan itu dan pertukaran itu dicantumkan di dalam akta itu."
1038,Pasal 1081,"Surat-surat dan bukti-bukti milik barang-barang yang dibagikan, harus diserahkan kepada orang yang mendapat barang itu sebagai bagiannya."
1039,Pasal 1082,"Surat-surat umum mengenai harta peninggalan harus tetap disimpan oleh orang yang ditunjuk dengan suara terbanyak para ahli waris, atau bila ada perselisihan, oleh orang yang diangkat Pengadilan Negeri atas permohonan mereka yang berkepentingan yang paling siap, tetapi orang itu wajib memberi kesempatan melihat surat-surat itu, dan memberikan petikan-petikan atau salinan-salinan menurut ketentuan pasal yang lalu."
1040,Pasal 1083,Tiap-tiap ahli waris dianggap langsung menggantikan pewaris dalam hal memiliki barang- barang yang diperolehnya dengan pembagian atau barang-barang yang dibelinya berdasarkan pasal 1076.
