,Pasal,Isi
1411,Pasal 1488,"Dalam hal pembeli membatalkan pembelian penjual wajib mengembalikan harga barang, jika itu telah diterima olehnya dan juga biaya yang telah dikeluarkan untuk melakukan pembelian dan penyerahan sejauh pembeli telah membayarnya menurut persetujuan."
1412,Pasal 1489,"Tuntutan dari pihak penjual untuk memperoleh penambahan uang harga penjualan dan tuntutan dari pihak pembeli untuk memperoleh pengurangan uang harga pembelian atau pembatalan pembelian, harus diajukan dalam waktu satu tahun, terhitung mulai dari hari dilakukannya penyerahan; jika tidak, maka tuntutan itu gugur."
1413,Pasal 1490,"Jika dua bidang pekarangan dijual bersama-sama dalam satu persetujuan dengan suatu harga dan luas masing-masing disebut tetapi yang satu ternyata lebih luas daripada yang lain, maka selisih ini dihapus dengan cara memperjumpakan keduanya sampai jumlah yang diperlukan, dan tuntutan untuk penambahan atau untuk pengurangan tidak boleh diajukan selain menurut aturan-aturan yang ditentukan di atas."
1414,Pasal 1491,"Penanggungan yang menjadi kewajiban penjual terhadap pembeli, adalah untuk menjamin dua hal, yaitu:"
1415,Pasal 1492,"Meskipun pada waktu penjualan dilakukan tidak dibuat janji tentang penanggungan, penjual demi hukum wajib menanggung pembeli terhadap tuntutan hak melalui hukum untuk menyerahkan seluruh atau sebagian barang yang dijual itu kepada pihak ketiga, atau terhadap beban yang menurut keterangan pihak ketiga dimilikinya atas barang tersebut tetapi tidak diberitahukan sewaktu pembelian dilakukan."
1416,Pasal 1493,"Kedua belah pihak, dengan persetujuan-persetujuan istimewa boleh memperluas atau mengurangi kewajiban yang ditetapkan oleh undang-undang ini dan bahkan mereka boleh mengadakan persetujuan bahwa penjual tidak wajib menanggung sesuatu apa pun."
1417,Pasal 1494,
1418,Pasal 1495,"Dalam hal ada janji yang sama, jika terjadi penuntutan hak melalui hukum untuk menyerahkan barang yang dijual kepada seseorang, maka penjual wajib mengembalikan uang harga pembelian, kecuali bila pembeli sewaktu pembelian diadakan telah mengetahui adanya penghukuman untuk menyerahkan barang yang dibelinya itu, atau membeli barang itu dengan menyatakan akan memikul sendiri untung ruginya."
1419,Pasal 1496,"Jika dijanjikan penanggungan atau jika tidak dijanjikan apa-apa, maka pembeli dalam hal adanya tuntutan hak melalui hukum untuk menyerahkan barang yang dibelinya kepada seseorang, berhak menuntut kembali dari penjual:"
1420,Pasal 1497,"Jika ternyata bahwa pada waktu diadakan penuntutan hak melalui hukum, barang itu telah merosot harganya atau sangat rusak, baik karena kelalaian pembeli maupun karena keadaan memaksa, maka penjual wajib mengembalikan uang harga pembelian seluruhnya."
1421,Pasal 1498,"Jika ternyata pada waktu diadakan penuntutan hak melalui hukum, barang itu telah bertambah harganya, meskipun tanpa perbuatan pembeli, maka penjual wajib untuk membayar kepada pembeli itu apa yang melebihi uang harga pembelian itu."
1422,Pasal 1499,Penjual wajib mengembalikan kepada pembeli atau menyuruh orang yang mengadakan penuntutan hak melalui hukum untuk mengembalikan segala sesuatu yang telah dikeluarkan oleh pembeli untuk pembetulan dan perbaikan yang perlu pada barang yang bersangkutan.
1423,Pasal 1500,"Jika hanya sebagian dari barang itu yang dituntut, sedangkan bagian itu, dalam hubungan dengan keseluruhannya adalah sedemikian penting sehingga pembeli tidak akan membeli barang itu, seandainya bagian itu tidak ada, maka ia dapat meminta pembatalan pembeliannya, asal ia memajukan tuntutan untuk itu dalam satu tahun setelah hari putusan atas penuntutan hak melalui hukum memperoleh kekuatan hukum yang pasti."
1424,Pasal 1501,"Dalam hal adanya hukuman untuk menyerahkan sebagian barang yang dijual itu, bila jual beli tidak dibatalkan, pembeli harus diberi ganti rugi untuk bagian yang harus diserahkan, menurut harga taksiran sewaktu ia diharuskan menyerahkan sebagian dari barangnya itu, tetapi tidak menurut perimbangan dengan seluruh harga pembelian, entah barang yang dijual itu telah naik atau telah turun harganya."
1425,Pasal 1502,"Jika ternyata bahwa barang yang dijual itu dibebani dengan pengabdian- pengabdian pekarangan tetapi hal itu tidak diberitahukan kepada pembeli, sedangkan pengabdian- pengabdian pekarangan itu sedemikian penting, sehingga dapat diduga bahwa pembeli tidak akan melakukan pembelian jika hal itu diketahuinya, maka ia dapat menuntut pembatalan pembelian, kecuali jika ia memilih menerima ganti rugi."
1426,Pasal 1503,"Jaminan terhadap suatu penuntutan hak menurut hukum berakhir, jika pembeli membiarkan diri dihukum oleh Hakim dengan suatu putusan yang sudah mempunyai kekuatan hukum yang pasti tanpa memanggil penjual, dan penjual itu membuktikan bahwa ada alasan untuk menolak gugatan tersebut."
1427,Pasal 1504,"Penjual harus menanggung barang itu terhadap cacat tersembunyi, yang sedemikian rupa sehingga barang itu tidak dapat digunakan untuk tujuan yang dimaksud, atau yang demikian mengurangi pemakaian, sehingga seandainya pembeli mengetahui cacat itu, ia sama sekali tidak akan membelinya atau tidak akan membelinya selain dengan harga yang kurang."
1428,Pasal 1505,Penjual tidak wajib menjamin barang terhadap cacat yang kelihatan dan dapat diketahui sendiri oleh pembeli.
1429,Pasal 1506,"Ia harus menjamin barang terhadap cacat yang tersembunyi, meskipun ia sendiri tidak mengetahui adanya cacat itu, kecuali jika dalam hal demikian ia telah meminta diperjanjikan bahwa ia tidak wajib menanggung sesuatu apa pun."
1430,Pasal 1507,
1431,Pasal 1508,"Jika penjual telah mengetahui cacat-cacat barang itu, maka selain wajib mengembalikan uang harga pembelian yang telah diterimanya, ia juga wajib mengganti segala biaya, kerugian dan bunga."
1432,Pasal 1509,"Jika penjual tidak mengetahui adanya cacat-cacat barang, maka ia hanya wajib mengembalikan uang harga barang pembelian dan mengganti biaya untuk menyelenggarakan pembelian dan penyerahan, sekedar itu dibayar oleh pembeli."
1433,Pasal 1510,"Jika barang yang mengandung cacat-cacat tersembunyi itu musnah karena cacat- cacat itu, maka kerugian dipikul oleh penjual yang terhadap pembeli wajib mengembalikan uang harga pembelian dan mengganti segala kerugian lain yang disebut dalam kedua pasal yang lalu; tetapi kerugian yang disebabkan kejadian yang tak disengaja, harus dipikul oleh pembeli."
1434,Pasal 1511,"Tuntutan yang didasarkan atas cacat yang dapat menyebabkan pembatalan pembelian, harus diajukan oleh pembeli dalam waktu yang pendek, menurut sifat cacat itu dan dengan mengindahkan kebiasaan-kebiasaan di tempat persetujuan pembelian dibuat."
1435,Pasal 1512,Tuntutan itu tidak dapat diajukan dalam hal penjualan-penjualan yang dilakukan atas kuasa Hakim.
1436,Pasal 1514,"Jika pada waktu membuat persetujuan tidak ditetapkan hal-hal itu, pembeli harus membayar di tempat dan pada waktu penyerahan."
1437,Pasal 1515,
1438,Pasal 1516,"Jika dalam menguasai barang itu pembeli diganggu oleh suatu tuntutan hukum yang didasarkan hipotek atau suatu tuntutan untuk memperoleh kembali barang tersebut, atau jika pembeli mempunyai suatu alasan yang patut untuk khawatir akan diganggu dalam penguasaannya, maka ia dapat menangguhkan pembayaran harga pembelian sampai penjual menghentikan gangguan tersebut, kecuali jika penjual memilih memberikan jaminan atau jika telah diperjanjikan bahwa pembeli wajib membayar tanpa mendapat jaminan atas segala gangguan."
1439,Pasal 1517,"Jika pembeli tidak membayar harga pembelian, maka penjual dapat menuntut pembatalan jual beli itu menurut ketentuan-ketentuan Pasal 1266 dan 1267."
1440,Pasal 1518,"Meskipun demikian, dalam hal penjualan barang-barang dagangan dan perabot rumah, pembatalan pembelian untuk kepentingan penjual terjadi demi hukum dan tanpa peringatan, setelah lewatnya waktu yang ditentukan untuk mengambil barang yang dijual."
1441,Pasal 1520,Hak untuk membeli kembali tidak boleh diperjanjikan untuk waktu yang lebih lama dari lima tahun.
1442,Pasal 1521,Jangka waktu yang ditetapkan harus diartikan secara mutlak dan tidak boleh diperpanjang oleh Hakim; bila penjual lalai memajukan tuntutan untuk membeli kembali dalam tenggang waktu yang telah ditentukan maka pembeli tetap menjadi pemilik barang yang telah dibelinya.
1443,Pasal 1522,"Jangka waktu ini berlaku untuk kerugian tiap orang, bahkan untuk kerugian anak-anak yang belum dewasa, tanpa mengurangi hak mereka untuk menuntut penggantian kepada orang yang bersangkutan jika ada alasan untuk itu."
1444,Pasal 1523,"Penjual suatu barang tak bergerak yang telah meminta diperjanjikan hak untuk membeli kembali barang yang dijualnya, boleh menggunakan haknya terhadap seorang pembeli kedua, meskipun dalam persetujuan kedua belah tidak disebutkan janji tersebut."
1445,Pasal 1524,"Barangsiapa membeli dengan perjanjian membeli kembali, memperoleh segala hak penjual sebagai penggantinya ia dapat menggunakan hak lewat waktunya baik terhadap pemilik sejati saja yang mengira punya hak hipotek atau hak lain atas barang yang dijual itu."
1446,Pasal 1525,"Terhadap para kreditur kepada penjual, ia dapat menggunakan hak istimewa, untuk melaksanakan tuntutan hak melalui hukum."
1447,Pasal 1526,"Jika seseorang yang dengan perjanjian membeli kembali telah membeli suatu bagian dari suatu barang tak bergerak yang belum terbagi, setelah terhadapnya diajukan suatu gugatan untuk pemisahan dan pembagian menjadi pembeli dari seluruh barang tersebut bila orang ini hendak menggunakan hak membeli kembali."
1448,Pasal 1527,"Jika berbagai orang secara bersama-sama dan dalam satu persetujuan penjualan suatu barang yang menjadi hak mereka bersama, maka masing-masing hanya dapat menggunakan haknya untuk kembali sekedar mengenai bagiannya."
1449,Pasal 1528,"Hak yang sama terjadi bila seseorang yang sendirian menjual suatu barang, meninggalkan beberapa ahli waris."
1450,Pasal 1529,"Tetapi dalam hal termaksud dalam kedua pasal yang lalu, pembeli dapat menuntut supaya semua orang yang turut menjual atau yang turut menjadi ahli waris dipanggil untuk bermufakat tentang pembelian kembali barang yang bersangkutan seluruhnya, dan jika mereka tidak mencapai kesepakatan maka tuntutan membeli kembali harus ditolak."
1451,Pasal 1530,"Jika penjualan suatu barang kepunyaan berbagai orang tidak dilakukan oleh mereka bersama- sama untuk seluruhnya, melainkan masing-masing menjual sendiri-sendiri bagiannya maka masing-masing dapat sendiri-sendiri menggunakan haknya untuk membeli kembali bagian yang menjadi haknya; dan pembeli tidak boleh memaksa siapa pun yang menggunakan haknya secara demikian untuk mengoper barang yang bersangkutan seluruhnya."
1452,Pasal 1531,"Jika pembeli meninggalkan beberapa orang ahli waris, maka hak membeli kembali tidak dapat dipergunakan terhadap masing-masing dari mereka selain untuk jumlah sebesar bagiannya, baik dalam harta peninggalan yang belum dibagi maupun dalam hal harta peninggalan yang sudah dibagi di antara para ahli waris."
1453,Pasal 1532,"Penjual yang menggunakan perjanjian membeli tidak saja wajib mengembalikan seluruh uang harga pembelian semula melainkan juga mengganti semua biaya menurut hukum, yang telah dikeluarkan waktu menyelenggarakan pembelian serta penyerahannya, begitu pula biaya yang perlu untuk pembetulan-pembetulan dan biaya yang menyebabkan barang yang dijual bertambah harganya, yaitu sejumlah tambahannya itu."
1454,Pasal 1534,"Barang siapa menjual suatu piutang atau suatu hak yang tak berwujud lainnya, harus menanggung hak-hak itu benar ada pada waktu diserahkan biar pun penjualan dilakukan tanpa janji penanggungan."
1455,Pasal 1535,"Ia tidak bertanggung jawab atas kemampuan debitur kecuali jika ia mengikatkan dirinya untuk itu, tetapi dalam hak demikian pun ia hanya bertanggung jawab untuk jumlah harga pembelian yang telah diterimanya."
1456,Pasal 1536,
1457,Pasal 1537,"Barang siapa menjual suatu warisan tanpa memberi keterangan tentang barang demi barang, tidaklah menanggung apa-apa selain kedudukannya sebagai ahli waris."
1458,Pasal 1538,"Jika ia menikmati hasil suatu barang atau telah menerima suatu jumlah sebesar suatu piutang yang termasuk warisan tersebut, ataupun telah menjual beberapa barang dari harta peninggalan itu maka ia diwajibkan untuk menggantinya jika tidak dengan tegas diperjanjikan lain."
1459,Pasal 1539,"Sebaliknya, pembeli diwajibkan mengganti kepada penjual itu segala sesuatu yang oleh orang itu telah dikeluarkan untuk membayar utang-utang dan orang yang memegang suatu piutang terhadap warisan itu, kecuali jika diperjanjikan sebaliknya."
1460,Pasal 1540,"Bila sebelum penyerahan suatu piutang yang telah dijual, debitur membayar utangnya kepada penjual, maka hal itu cukup untuk membebaskan debitur."
1461,Pasal 1541,Tukar menukar ialah suatu persetujuan dengan mana kedua belah pihak mengikatkan diri untuk saling memberikan suatu barang secara timbal balik sebagai ganti suatu barang lain.
1462,Pasal 1542,"Segala sesuatu yang dapat dijual, dapat pula jadi pokok persetujuan tukar-menukar."
1463,Pasal 1543,"Jika pihak yang satu telah menerima barang yang ditukarkan kepadanya, dan kemudian ia membuktikan kepada pihak yang lain bukan pemilik barang tersebut maka ia tidak dapat dipaksa untuk menyerahkan barang yang telah ia janjikan dari pihaknya sendiri melainkan hanya untuk mengembalikan barang yang telah diterimanya."
1464,Pasal 1544,"Barang siapa karena suatu tuntutan hak melalui hukum terpaksa melepaskan barang yang diterimanya dalam suatu tukar menukar, dapat memilih akan menuntut penggantian biaya, kerugian dan bunga dari pihak lawannya atau akan menuntut pengembalian barang yang telah ia berikan."
1465,Pasal 1545,"Jika barang tertentu, yang telah dijanjikan untuk ditukar musnah di luar kesalahan pemiliknya, maka persetujuan dianggap gugur dan pihak yang telah memenuhi persetujuan dapat menuntut kembali barang yang telah ia berikan dalam tukar-menukar."
1466,Pasal 1546,"Untuk lain-lainnya, aturan-aturan tentang persetujuan jual beli berlaku terhadap persetujuan tukar-menukar."
1467,Pasal 1548,"Sewa menyewa adalah suatu persetujuan, dengan mana pihak yang satu mengikatkan diri untuk memberikan kenikmatan suatu barang kepada pihak yang lain selama waktu tertentu, dengan pembayaran suatu harga yang disanggupi oleh pihak tersebut terakhir itu. Orang dapat menyewakan pelbagai jenis barang, baik yang tetap maupun yang bergerak."
1468,Pasal 1549,Dihapus dengan S. 1926 - 335 jo. 458.
1469,Pasal 1551,
1470,Pasal 1552,"Pihak yang menyewakan harus menanggung penyewa terhadap semua cacat barang yang disewakan yang merintangi pemakaian barang itu, meskipun pihak yang menyewakan itu sendiri tidak mengetahuinya pada waktu dibuat persetujuan sewa. Jika cacat-cacat itu telah mengakibatkan suatu kerugian bagi penyewa, maka pihak yang menyewakan wajib memberikan ganti rugi."
1471,Pasal 1553,"Jika barang yang disewakan musnah sama sekali dalam masa sewa karena suatu kejadian yang tak disengaja, maka persetujuan sewa gugur demi hukum. Jika barang yang bersangkutan hanya sebagian musnah, maka penyewa dapat memilih menurut keadaan, akan meminta pengurangan harga atau akan meminta pembatalan persetujuan sewa, tetapi dalam kedua hal itu ia tidak berhak atas ganti rugi."
1472,Pasal 1554,"Pihak yang menyewakan tidak diperkenankan selama waktu sewa, mengubah bentuk atau susunan barang yang disewakan."
1473,Pasal 1555,"Jika dalam masa sewa pada barang yang disewakan itu terpaksa diadakan pembetulan- pembetulan yang tidak dapat ditunda sampai berakhirnya masa sewa, maka penyewa harus menerimanya betapapun beratnya kesusahan yang disebabkannya, dan meskipun selama dilakukannya pembetulan-pembetulan itu ia terpaksa kehilangan sebagian dari barang yang disewakan."
1474,Pasal 1556,"Pihak yang menyewakan tidak wajib menjamin penyewa terhadap rintangan dalam merintangi dalam menikmati barang sewa yang dilakukan oleh pihak ketiga tanpa berdasarkan suatu hak atas barang sewa itu, hal ini tidak mengurangi hak penyewa untuk menuntut sendiri orang itu."
1475,Pasal 1557,"Jika sebaliknya penyewa diganggu dalam kenikmatannya karena suatu tuntutan hukum mengenai hak milik atas barang yang bersangkutan, maka ia berhak menuntut pengurangan harga sewa menurut perimbangan, asal gangguan atau rintangan itu telah diberitahukan secara sah kepada pemilik."
1476,Pasal 1558,"Jika orang-orang yang melakukan perbuatan-perbuatan tersebut menyatakan bahwa mereka mempunyai suatu hak atas barang yang disewakan, atau jika penyewa sendiri digugat untuk mengosongkan seluruh atau sebagian dari barang yang disewa atau untuk menerima pelaksanaan pengabdian pekarangan, maka ia wajib memberitahukan hal itu kepada pihak yang menyewakan dan dapat memanggil pihak tersebut sebagai penanggung. Bahkan ia dapat menuntut supaya ia dikeluarkan dari perkara, asal ia menunjuk untuk siapa ia menguasai barang yang bersangkutan."
1477,Pasal 1559,"Penyewa, jika tidak diizinkan, tidak boleh menyalahgunakan barang yang disewanya atau melepaskan sewanya kepada orang lain, atas ancaman pembatalan persetujuan sewa dan penggantian biaya, kerugian dan bunga sedangkan pihak yang menyewakan, setelah pembatalan itu, tidak wajib menaati persetujuan ulang sewa itu. Jika yang disewa itu berupa sebuah rumah yang didiami sendiri oleh penyewa, maka dapatlah ia atas tanggung jawab sendiri menyewakan sebagian kepada orang lain jika hak itu tidak dilarang dalam persetujuan."
1478,Pasal 1560,Penyewa harus menepati dua kewajiban utama:
1479,Pasal 1561,"Jika penyewa memakai barang yang disewa untuk suatu keperluan lain dari yang menjadi tujuannya, atau untuk suatu keperluan yang dapat menimbulkan suatu kerugian bagi pihak yang menyewakan maka pihak ini, menurut keadaan dapat meminta pembatalan sewa."
1480,Pasal 1562,"Jika antara pihak yang menyewakan dan pihak yang menyewa telah dibuat suatu pertelaan tentang barang yang disewakan, maka pihak yang belakangan ini wajib mengembalikan barang itu dalam keadaan seperti waktu barang itu diterima menurut pertelaan tersebut kecuali yang telah musnah atau berkurang harganya sebagai akibat dari tuanya barang atau sebagai akibat dari kejadian-kejadian yang tak disengaja dan tak dapat dihindarkan."
1481,Pasal 1563,"Jika tidak dibuat suatu pertelaan maka penyewa, mengenai pemeliharaan yang menjadi beban para penyewa, dianggap telah menerima barang yang disewa itu dalam keadaan baik, kecuali jika dibuktikan sebaliknya dan ia harus mengembalikan barang itu dalam keadaan yang sama."
1482,Pasal 1564,
1483,Pasal 1565,"Akan tetapi ia tidak bertanggung jawab atas kebakaran, kecuali jika pihak yang menyewakan membuktikan bahwa kebakaran itu disebabkan oleh kesalahan penyewa."
1484,Pasal 1566,"Penyewa bertanggung jawab atas segala kerusakan atau kerugian yang ditimbulkan pada barang sewa oleh teman-temannya serumah, atau oleh mereka yang mengambil alih sewanya."
1485,Pasal 1567,"Pada waktu mengosongkan barang yang disewa, penyewa boleh membongkar dan membawa segala sesuatu yang dengan biaya sendiri telah dibuat pada barang yang disewa asal pembongkaran dan pembawaan itu dilakukan tanpa merusak barang yang disewa."
1486,Pasal 1568,Dihapus dengan S. 1925 - 525.
1487,Pasal 1569,"Jika terjadi perselisihan tentang harga sewa yang dibuat secara lisan dan sudah dijalankan, sedangkan tanda bukti pembayaran tidak ada, maka pihak yang menyewakan harus dipercaya atas sumpahnya kecuali bila penyewa memilih untuk menyuruh para ahli menaksir harga sewa."
1488,Pasal 1570,"Jika sewa dibuat dengan tulisan, maka sewa itu berakhir demi hukum bila waktu yang ditentukan telah lampau, tanpa diperlukan suatu pemberhentian untuk itu."
1489,Pasal 1571,"Jika sewa tidak dibuat dengan tulisan, maka sewa itu tidak berakhir pada waktu yang ditentukan, melainkan setelah salah satu pihak memberitahukan kepada pihak yang lain bahwa ia hendak menghentikan sewanya dengan mengindahkan tenggang waktu yang diharuskan menurut kebiasaan setempat."
1490,Pasal 1572,"Jika pihak yang satu telah memberitahukan kepada pihak yang lain bahwa ia berhak menghentikan sewanya, maka penyewa meskipun ia tetap menikmati barang yang bersangkutan, tidak dapat mengemukakan adanya suatu penyewa ulang secara diam-diam."
1491,Pasal 1573,
1492,Pasal 1574,"Dalam hal kedua pasal tersebut di atas, penanggungan utang yang dibuat untuk penyewaan tidak meliputi kewajiban yang terjadi akibat perpanjangan sewa."
1493,Pasal 1575,Persetujuan sewa sekali-kali tidak hapus dengan meninggalnya pihak yang menyewakan ataupun pihak yang menyewa.
1494,Pasal 1576,"Dengan dijualnya barang yang disewa, sewa yang dibuat sebelumnya tidak diputuskan kecuali bila telah diperjanjikan pada waktu menyewakan barang. Jika ada suatu perjanjian demikian, penyewa tidak berhak menuntut ganti rugi bila tidak ada suatu perjanjian yang tegas, tetapi jika ada perjanjian demikian, maka ia tidak wajib mengosongkan barang yang disewa selama ganti rugi yang terutang belum dilunasi."
1495,Pasal 1577,"Pembeli dengan perjanjian membeli kembali tidak dapat menggunakan wewenangnya untuk memaksa penyewa mengosongkan barang yang disewa, sebelum ia menjadi pemilik mutlak dengan lewatnya tenggang waktu yang ditentukan untuk pembelian kembali."
1496,Pasal 1578,"Seorang pembeli yang hendak menggunakan wewenangnya yang diperjanjikan dalam persetujuan sewa, untuk memaksa penyewa mengosongkan barang sewa jika barangnya dijual, wajib memperingatkan penyewa sekian lama sebelumnya, sebagaimana diharuskan oleh adat setempat mengenai penghentian sewa. Dalam hal sewa tanah, peringatan tersebut harus disampaikan sedikitnya satu tahun sebelum pengosongan."
1497,Pasal 1579,"Pihak yang menyewakan tidak dapat menghentikan sewa dengan menyatakan hendak memakai sendiri barangnya yang disewakan, kecuali jika telah diperjanjikan sebaliknya."
1498,Pasal 1580,Jika dalam persetujuan sewa telah disetujui bahwa pihak yang menyewakan akan berhak memakai sendiri rumah atau tanah yang disewakan maka ia wajib memberitahukan kehendaknya untuk menghentikan sewa sekian lama sebelumnya. sebagaimana ditetapkan dalam Pasal 1578.
1499,Pasal 1581,Penyewa yang tidak melengkapi sebuah sewa rumah dengan perabot rumah secukupnya. dapat dipaksa untuk mengosongkan rumah itu kecuali bila ia memberikan cukup jaminan untuk pembayaran uang sewa.
1500,Pasal 1582,Seorang penyewa kedua tidak wajib membayar kepada pemilik lebih dari jumlah harga sewa kedua yang masih terutang kepada penyewa pertama pada waktu dilakukan suatu penyitaan. dan ia tak boleh mengajukan pembayaran yang dilakukan sebelumnya. kecuali jika pembayaran itu dilakukan menurut suatu perjanjian yang dinyatakan dalam persetujuan sewa itu atau menurut kebiasaan setempat.
1501,Pasal 1583,"Pembetulan-pembetulan kecil sehari-hari, dipikul oleh penyewa. Jika tidak ada persetujuan mengenai hal itu maka dianggap demikianlah pembetulan pada lemari toko, daun jendela, kunci dalam, kaca jendela, baik di dalam maupun di luar rumah dan segala sesuatu yang dianggap termasuk itu, menurut kebiasaan setempat. Meskipun demikian, pembetulan- pembetulan itu harus dipikul oleh pihak yang menyewakan bila pembetulan itu terpaksa dilakukan karena kerusakan barang yang disewa atau karena keadaan yang memaksa."
1502,Pasal 1584,"Menjaga kebersihan sumur, kolam air hujan, dan tempat buang air besar dibebankan kepada pihak yang menyewakan, jika tidak diperjanjikan sebaliknya. Menjaga kebersihan asap, jika tidak ada perjanjian dibebankan kepada pihak yang menyewa."
1503,Pasal 1585,"Sewa mebel untuk melengkapi sebuah rumah, tempat kediaman, toko atau ruangan lainnya, harus dianggap telah dibuat untuk jangka waktu penyewaan rumah, tempat kediaman, toko atau ruangan menurut kebiasaan setempat."
1504,Pasal 1586,"Penyewaan kamar yang dilengkapi dengan mebel harus dianggap telah dilakukan untuk tahunan, bila dibuat atas pembayaran sejumlah uang tiap tahun; untuk bulanan, bila dibuat atas pembayaran sejumlah uang tiap bulan; untuk harian, bila dibuat atas pembayaran sejumlah uang tiap hari. Jika tidak ternyata bahwa penyewaan dibuat atas pembayaran sejumlah uang tiap tahun, tiap bulan atau tiap hari, maka penyewaan dianggap telah dibuat menurut kebiasaan setempat."
1505,Pasal 1587,"Jika penyewa sebuah rumah atau ruangan, setelah berakhirnya waktu yang ditentukan dalam suatu persetujuan tertulis, tetap menguasai barang sewa, sedangkan pihak yang menyewakan tidak melawannya maka dianggaplah bahwa penyewa tetap menguasai barang yang disewanya atas dasar syarat-syarat yang sama untuk waktu yang ditentukan oleh kebiasaan setempat, dan ia tidak dapat meninggalkan barang sewa atau dikeluarkan dari situ, kecuali sesudah ada pemberitahuan tentang penghentian sewa, yang dilakukan menurut kebiasaan."
1506,Pasal 1589,"Jika penyewa tanah tidak melengkapi tanah itu dengan ternak atau peralatan pertanian yang diperlukan untuk pengembalian atau penanaman; jika ía berhenti melakukan pengembalian atau penanaman. atau dalam hal itu tidak berlaku sebagai kepala rumah tangga yang baik, jika ia memakai barang yang disewa untuk suatu tujuan yang lain dengan tujuan yang dimaksudkan atau, pada umumnya, jika ia tidak memenuhi janji-janji yang dibuat dalam persetujuan sewa dan karena itu timbul suatu kerugian bagi pihak yang menyewakan. Maka pihak itu berhak untuk menuntut pembatalan sewa menurut keadaan, serta penggantian biaya, kerugian dan bunga."
1507,Pasal 1590,Semua penyewa tanah diwajibkan menyimpan hasil-hasil tanah di tempat penyimpanan yang telah disediakan untuk itu.
1508,Pasal 1591,"Penyewa tanah diwajibkan, atas ancaman penggantian biaya, kerugian dan bunga, untuk melaporkan kepada pemilik tanah itu segala peristiwa yang dilakukan dalam mengerjakan tanah yang disewa. Pemberitahuan itu harus dilakukan dalam jangka waktu yang sama seperti yang ditentukan antara waktu gugatan dari hari menghadap di muka sidang pengadilan menurut jarak tempat-tempat."
